,review_id,product_id,reviewer_id,stars,review_body,review_title,language,product_category
185236,es_0501957,product_es_0129677,reviewer_es_0040865,5,"es muy ligera, pero da bastante calor. soy un hombre de 1,90 Mt y 100 kg, la talla es justita ( pero me pasa con mucha ropa de marca igual)",ligero y calentito,es,apparel
79745,es_0751486,product_es_0959351,reviewer_es_0881997,2,No las volver칤a a comprar,Demasiado pl치stico,es,apparel
120596,es_0314647,product_es_0696205,reviewer_es_0619621,4,"Lo compre para un regalo, lo que me ha gustado es que tenga un el치stico en el tobillo, me cost칩 encontrar pijamas que tuvieran el el치stico.",Me gusto para regalar,es,apparel
44189,es_0276437,product_es_0009023,reviewer_es_0866409,2,Muy bonito para pechos no muy grandes,Est치 bien,es,apparel
64835,es_0062930,product_es_0719415,reviewer_es_0804837,2,"No queda como en la foto porque las mangas no son ajustadas, si no que quedan anchas y por tanto cambia todo el efecto del vestido",Las mangas quedan anchas,es,apparel
118318,es_0121772,product_es_0297498,reviewer_es_0031127,3,"Me lleg칩 en el plazo previsto, pero cuando me lo prob칠, me estaba un poco ancho (y eso que tiene que estar pegado y ped칤 la talla m치s chica). Adem치s se me rompi칩 una de las tiras que se unen a la media, por lo que hace el producto inservible. A칰n as칤 lo arregl칠 y cuando me lo puse y lo estren칠, los broches se iban soltando porque no estaban muy sujetos. Para el percio que tiene, no se puede pedir mucho m치s, por eso las tres estrellas",Fr치gil y de poca calidad,es,apparel
111232,es_0747585,product_es_0985499,reviewer_es_0376919,3,"Me han parecido s칰per c칩modos, el color es s칰per bonito. La 칰nica pega es que son un pel칤n cortos para mi gusto, no soy muy moderna, pero es culpa m칤a porque no me fij칠.",Pantalones ch치ndal,es,apparel
46815,es_0468609,product_es_0384933,reviewer_es_0880116,2,"Devolvi el que ped칤 porque no se ajustaba a mis medidas elegidas, he pedido una talla menos y me ha llegado este que lleva unas etiquetas indicando el material pero es muy vistoso y quedan muy feas,las anteriores no lo llevaban y la tela era mas suave. Hay un error de costura y esto no me ha gustado nada no se si devolver el producto de nuevo, no estoy satisfecha del todo.",Error de costura,es,apparel
111091,es_0921960,product_es_0430475,reviewer_es_0548617,3,M치s que zapatillas son unos calcetines antideslizantes.,Zapatillas ?,es,apparel
197531,es_0649767,product_es_0878365,reviewer_es_0904931,5,divertidos y por fin no tengo que emparejar los calcetines... una preocupacion menos.... llegaron en tiempo acordados y perfectos. son de buena calidad y calentitos.,Son divinos....,es,apparel
117694,es_0792406,product_es_0287653,reviewer_es_0378483,3,"Es de buena calidad pero demasiado poca talla y es demasiado corto, se me sube a menudo y esto que la compr칠 en una talla mayor que la m칤s.","Muy corta, da poca talla",es,apparel
109900,es_0113526,product_es_0091379,reviewer_es_0165911,3,"Para un bebe de 1 a침o no va tan bien ,en mi experiencia ,al tener lo brazos a los lados esta incomodo y la cabeza se va para atras,no traga agua pero no esta comodo,se escurre por abajo ,yo lo provare cuando sea mas grande a ver que pass",Regular,es,apparel
18703,es_0518425,product_es_0908248,reviewer_es_0541823,1,Horrible. Para un disfraz est치 bien. Para lo que yo necesitaba no,Demasiado volumen. Se nota mucho los aros,es,apparel
80779,es_0436488,product_es_0118106,reviewer_es_0853496,3,Pantal칩n y gorro de mala calidad y de color raro. El body sin embargo es lo 칰nico que us칠 es de buena calidad y bonito,Solo vale la pena el body,es,apparel
60962,es_0361976,product_es_0252555,reviewer_es_0844454,2,"La gorra es bonita. Pero las costuras no est치n alineadas. Para el precio que tiene, me ha dejado bastante desilusionado. Ya que era para un regalo, y no me a echo quedar bien.",Costuras mal alineadas,es,apparel
47599,es_0255029,product_es_0913234,reviewer_es_0087750,2,Cada uno de un tama침o no me est치n son muy peque침os,Cada uno de una talla y los dos peque침os,es,apparel
64808,es_0230363,product_es_0534285,reviewer_es_0684846,2,"Si eres ancha de caderas no te sirve, viene una talla peque침a. En cuanto a calidad del material bien.",Faja postparto,es,apparel
131388,es_0505981,product_es_0583673,reviewer_es_0687018,4,Muy c칩modos y confortables. A ver lo que duran,Comodos,es,apparel
196699,es_0397095,product_es_0771638,reviewer_es_0066603,5,"Las uso porque estoy muchas horas delante del ordenador. Llevo poco tiempo us치ndolas, pero resultan c칩modas y est치n hechas con buenos materiales. Las recomiendo.",C칩modas y pr치cticas.,es,apparel
123771,es_0549794,product_es_0030093,reviewer_es_0613639,4,Est치 bien de tama침o para m칤 nieta de 5 a침os. Es muy bonita y parece de buena calidad. Espero que con el huso sea as칤. C칩mo no la ha probado le doy 4 estrellas.,Opinion sobre mochila Patrulla Canina,es,apparel
92864,es_0550427,product_es_0247184,reviewer_es_0498914,3,"NO son muy antideslizantes y encogen bastante despues del primer lavado, a pesar de todo son 칰tiles y de buena calidad",Calcetines antideslizantes,es,apparel
116933,es_0842174,product_es_0351946,reviewer_es_0344264,3,"La calidad esta bien, pero me quedan demasiado ajustados a la cintura a pesar de ser talla XL, y yo solo soy un 34 en pantalones.",El치stico demasiado ajustado,es,apparel
75133,es_0341008,product_es_0582110,reviewer_es_0830523,2,La pintura met치lica negra ven칤a descascarillada en una de las patillas.,Lleg칩 con un defecto de fabricaci칩n.,es,apparel
34008,es_0937494,product_es_0292743,reviewer_es_0048723,1,No me ha gustado nada.despues de mes y medio no lo mandan,una estafa grande,es,apparel
142213,es_0274679,product_es_0247177,reviewer_es_0749585,4,"Seguramente me equivoqu칠 yo. Tengo 98 cms de cintura y ped칤 la XL que es la que usaba con Calvin Klein. Por lo que veo, esta XL ser칤a para una cintura de 102 cms. Ya he pedido otra talla m치s peque침a, porque la calidad me parece buena, y el resultado... 춰ya veremos!",Talla,es,apparel
54198,es_0294075,product_es_0329997,reviewer_es_0443467,2,"Yo utilizo la talla 38-40 y me ped칤 la L y a칰n as칤 quedan algo ajustados de gl칰teos y muslos con lo que cuesta algo ponerlos, adem치s de que al quedar algos justos el material sint칠tico junto a las costuras se a roto y se esta despegando de la tela dando mala apariencia.",Son c칩modos aunque cuesta un poco ponerlos. Pedir una talla mas ya que vienen peque침os,es,apparel
198485,es_0790390,product_es_0092789,reviewer_es_0373807,5,"Muy bien 游녨 la gorra es igual a la imagen, es original",Bonita,es,apparel
67597,es_0760707,product_es_0222693,reviewer_es_0521671,2,"Est치n muy bien, la visi칩n tambi칠n, pero me quedan grandes.",Gafas polarizadas,es,apparel
6511,es_0090217,product_es_0291759,reviewer_es_0948895,1,"No saben diferenciar entre el fucsia y el violeta, me madaron en 2 ocasiones la funda del color incorrecto, al final la devolv칤, desist칤 y tuve que comprar otra diferente",춰춰El rosa no es morado!!,es,apparel
11911,es_0709365,product_es_0209625,reviewer_es_0900034,1,"Una estafa, peque침os, no te viene tan adornado, es super cutre, nada que ver con la foto. No os lo recomiendo, eran para regalar y da hasta pena darselos a alguien",Marta,es,apparel
117764,es_0984512,product_es_0974294,reviewer_es_0550967,3,"El cintur칩n que aparece en la foto parece m치s antiguo, tiene un toque rallado, y con pelitos en los lados que lo hace parecer r칰stico y no es as칤. El material es de calidad, pero yo lo quer칤a con el toque r칰stico que he comentado",No parece en la foto,es,apparel
102295,es_0983611,product_es_0977057,reviewer_es_0914633,3,Las posturas el bot칩n de encendido se presiona y se apaga .,El bot칩n de encendido molesta,es,apparel
98999,es_0165298,product_es_0822472,reviewer_es_0543566,3,"no est치 mal, para el precio que tiene est치 bastante bien, la tela es fina de licra y queda chulo puesto",calidad precio buena,es,apparel
91435,es_0388796,product_es_0810368,reviewer_es_0674777,3,"Lleg칩 muy tarde, pasado halloween. Es una pena porque est치 bien hecho y la calidad del algod칩n es buena, eso me sorprendi칩. Solicit칠 la devoluci칩n pero deb칤a pagar el env칤o entonces el vendedor me ofreci칩 reintegrarme el 30 por ciento de lo que cost칩 y bueno mejor eso que nada porque ya a mi beb칠 cuando Le toque otro halloween no le va a quedar",Lleg칩 tarde. Vendedor amable,es,apparel
94832,es_0034110,product_es_0498468,reviewer_es_0226146,3,"la impresion buena y en general se ve bien, la talla correcta pero la tela es un poco fina y transparenta algo",muy chula pero transparenta,es,apparel
172177,es_0666213,product_es_0439479,reviewer_es_0912117,5,el tacto es muy agradable y de muy buena calidad. abriga bastante. recomendable!,muy calentita,es,apparel
57629,es_0254752,product_es_0435615,reviewer_es_0922958,2,Buena calidad pero demasiado peque침a,Tama침o,es,apparel
118919,es_0728033,product_es_0909707,reviewer_es_0323519,3,Pensaba que era tejido de algod칩n tipo camiseta y es un tejido de jersey.,Tejido de jersey,es,apparel
87666,es_0988211,product_es_0443923,reviewer_es_0441940,3,"El vestido en si est치 bien,pero la cola viene muy larga,y la parte del cuello es demasiada ancha no me ha gustado mucho lo del cuello,porque viene como de hilos...pero bueno por el precio la verdad q est치 bastante bien.yo uso una talla L y he pedido la S porque en los comentarios la gente dec칤a q ven칤a grande y es verdad,a칰n as칤 la S me est치 algo ancha",Pasable,es,apparel
152334,es_0702557,product_es_0560267,reviewer_es_0357368,4,"segun las medidas he pedido una talla L de los granates y quedan mas grandes de lo que me esperaba. No son unos guantes excesivamente calientes, tienen un poco de pelito, pero son mas de estetica que de abrigar el dias bajo 0. Son muy monos con los lacitos a contraste, es un regalo muy bonito, lo dificil es acertar con la talla",Muy monos aunque tallan un poco grande,es,apparel
157497,es_0955163,product_es_0870300,reviewer_es_0379809,4,"El producto est치 de acuerdo con mis expectativas, y encuentro una buena relaci칩n entre calidad y precio. La estoy utilizando normalmente para mis horas de ocio. Y la misma opini칩n para el resto de las camisetas que recib칤 en el mismo pedido.- UN SALUDO.-",La calidad del producto.-,es,apparel
36030,es_0557318,product_es_0838923,reviewer_es_0105763,1,"No lo recib칤 en la fecha estimada y como era para un evento concreto, ya no me vale y necesitar칤a devolverlo",NO LLEGO EN LA FECHA ESTIMADA,es,apparel
114685,es_0129164,product_es_0979729,reviewer_es_0138081,3,El que no es que vienen dos rotos,Calcetines,es,apparel
27575,es_0522707,product_es_0971464,reviewer_es_0199680,1,"Acabo de recibir el pedido de calcetines Vicent Creation. En cuanto los abr칤, pude observar que los acabados son bastante malos. Se empieza a deshilachar por el borde y las costuras. Pero lo peor es el tama침o. Seleccion칠 la talla 39-42 (yo tengo un 40) y los calcetines son enormes. Se arrugan en el zapato y son muy inc칩modos.",Vicent creation 6 pares,es,apparel
171846,es_0083689,product_es_0349708,reviewer_es_0337168,5,"- C칩mo aparece en la imagen, perfecto. Es un producto de calidad y el vendedor lo env칤o bastante r치pido.- *",C칩mo se detalla,es,apparel
170292,es_0987239,product_es_0410429,reviewer_es_0487339,5,"Cumple con su misi칩n, que es proteger las gafas. Un poco voluminosa pero sin problemas.",Magnifica,es,apparel
109323,es_0608508,product_es_0585492,reviewer_es_0412366,3,"era para regalar, pero todav칤a no los he entregado, aunque ya compr칠 otros con anterioridad y funcionan a la perfecci칩n.",muy bien,es,apparel
170016,es_0203666,product_es_0497842,reviewer_es_0925077,5,Hermosos los lentes me encantan. Son iguales a la foto!!!,Muy bellos y buena calidad,es,apparel
178710,es_0159481,product_es_0231341,reviewer_es_0285787,5,Este vestido es muy lindo! A mi hija no le gusta usar chaquetas y el vestido de manga larga es exactamente lo que necesita usar en este clima. Ella ten칤a muchos complementos cuando salimos con este atuendo.,Este vestido es muy lindo!,es,apparel
60496,es_0765989,product_es_0159084,reviewer_es_0188768,2,Pues la verdad esperaba mucho m치s del producto el material al tacto se nota que es muy malo como si fueran del chino,Regular,es,apparel
185941,es_0390945,product_es_0318030,reviewer_es_0818410,5,"Cuatro pares de calcetines de muy buena calidad a muy buen precio, y env칤o r치pido y sin problemas, muy contenta con la compra",Cristina,es,apparel
76801,es_0718467,product_es_0859058,reviewer_es_0899493,2,"Hola no estoy contenta s칩lo me han mandado el squishy del ciervo y el de pastel de fresa no. Si no estoy equivocada eran los dos squishy ,no se si habr치 visto alg칰n error .gracias",Maria dolores,es,apparel
171095,es_0205918,product_es_0698356,reviewer_es_0536533,5,Muy 칰tiles y c칩modas de llevar. Soy despistado y suelo olvidarme las gafas para leer con estas siempre salgo de un apuro,Buena elecci칩n.,es,apparel
81644,es_0681562,product_es_0952238,reviewer_es_0160919,3,Muy estrecha y para cubrir de avispa. Deber칤as pesar menos de 60kg para que vaya bien de contorno,Estrecha y corta de contorno,es,apparel
164769,es_0744744,product_es_0119964,reviewer_es_0038146,5,"Es un poco corto,pero muy bonito. A mi sobrina le ha encantado.",Muy bonito,es,apparel
114594,es_0417124,product_es_0025732,reviewer_es_0478079,3,No tiene forma para el culo y te lo chafa,Pasable,es,apparel
134992,es_0922064,product_es_0121130,reviewer_es_0713191,4,"Tiene buen aspecto, recomiendo su compra",CORRECTO,es,apparel
185550,es_0854743,product_es_0727451,reviewer_es_0691924,5,Es muy confortable y permite andar descalzo por la casa con ellos puestos.,Satisfacci칩n con la compra realizada,es,apparel
113338,es_0417606,product_es_0230746,reviewer_es_0461107,3,La braguita no tiene elastico asi que no se ajusta muy bien. El sujetador queda bastante bien.no est치 mal para el precio que tiene,No est치 mal,es,apparel
181009,es_0434602,product_es_0463072,reviewer_es_0169485,5,Me gusta el estilo de la camiseta y su logo musical.,Look vintage.,es,apparel
10047,es_0117271,product_es_0728125,reviewer_es_0616936,1,Es muy bonito.. Pero me ha llegado tarde y defectuoso y con talla equivocada,Bonito y elastico,es,apparel
55301,es_0394699,product_es_0343187,reviewer_es_0317496,2,Bonito pero tallaje peque침o,Rapidez,es,apparel
80183,es_0589900,product_es_0552044,reviewer_es_0608466,3,Esperaba algo m치s s칩lido en las gotas de silicona que producen el agarre al suelo. Parece que con el uso se van a caer. Habr치 que probarlo en las clases de Pilates y editar el comentario m치s adelante....,Habr치 que probarlo...,es,apparel
109623,es_0236012,product_es_0403699,reviewer_es_0531430,3,"Tardo en llegar mas de un mes,pero esta muy logrado y en todo momento el servicio de atencion al cliente me mantuvo informada.",Tarda mucho en llegar pero merece la pena,es,apparel
167212,es_0427907,product_es_0483612,reviewer_es_0184922,5,"Pues es tal cu치l a la imagen, tiene un falso bolsillo, como pega dir칤a que no abriga mucho pero me ha gustado bastante.",Perfecto,es,apparel
149784,es_0618484,product_es_0607021,reviewer_es_0086231,4,"La sensaci칩n en la mano es de endebles. Dir칤a que no van a durar demasiado. Pero de momento parece que aguantan... Como ya hab칤a le칤do en otras opiniones, el corte o el pulido del cristal no son buenos y hay imperfecciones. En mi caso no molestan, pero a veces se notan. Puede que dependiendo de d칩nde est칠n lleguen a molestar m치s",Dan el pego,es,apparel
93552,es_0727776,product_es_0119988,reviewer_es_0836091,3,"Lleg칩 con la cremallera rota . Por lo dem치s es d bien material, f치cil d vestir y muy gracioso. La gorra es muy 칰til porque al ser d tmb d licra se adapta a la cabeza sin apretar, seca r치pido y protege la nuca","Muy 칰til , c칩modo y pr치ctico. La gorra es lo mejor",es,apparel
63676,es_0423207,product_es_0603708,reviewer_es_0684741,2,Al ser una sola pieza se abren los botones de la entrepierna a la que coges el Ni침o.,Tendria de ser dos piezas,es,apparel
83240,es_0900230,product_es_0500662,reviewer_es_0957020,3,"son muy altos, y eso no me gusta mucho porque puestos quedan un poco raro. El material es bueno y son c칩modos, pero altos.",Me gustan pero...,es,apparel
150462,es_0681096,product_es_0539931,reviewer_es_0889274,4,El tejido es muy suave y la talla pedida se adapta perfectamente a mi pie. Estoy contento con la compra,Perfectos,es,apparel
162234,es_0600344,product_es_0548356,reviewer_es_0205576,5,"Lo ped칤 ayer y hoy ya lo tengo en casa. Es precioso, lo recomiendo al 100%. Ideal para regalo. Cintur칩n muy poco visto ya que es muy original y de muy buena calidad. Si est치is pensando en hacer un buen regalo, a vuestra pareja hermano o padre, no lo dud칠is.",Me ha encantado,es,apparel
29020,es_0833623,product_es_0056039,reviewer_es_0729796,1,"Ped칤 dos de diferentes tallas 1 me lleg칩 tard칤simo y me dijeron que se hab칤a extraviado y el otro no siquiera me a llegado,ellos mismos me han devuelto el dinero.",Entregas,es,apparel
27867,es_0062476,product_es_0341324,reviewer_es_0933163,1,"No me gustan porque tienen costuras y hacen el culo como si fueras un beb칠 con pa침ales, eso si, son muy calentitas",Con costuras,es,apparel
179701,es_0441393,product_es_0921860,reviewer_es_0068665,5,Recibidos r치pido y todo correcto,C칩modos,es,apparel
176030,es_0365849,product_es_0396765,reviewer_es_0176906,5,"Estoy embarazada de casi 7 meses, me molesta la zona lumbar y al ponerme el cintur칩n noto alivio y sensacion de ligereza, es bastante c칩modo. Lo recomiendo",Cumple su funci칩n,es,apparel
148311,es_0088631,product_es_0096491,reviewer_es_0175788,4,"Son muy bonitos, tal como en las im치genes. Mi hijo tiene un 43 y le quedan un poquit칤n peque침os, pero a칰n as칤 se los pone.",Es lo que esper치bamos.,es,apparel
6234,es_0555806,product_es_0013614,reviewer_es_0321006,1,"Es un timo!!! No la entregan nunca, llevo esperando meses y nunca llega. Imposible saber de la compa침칤a de transportes ni de la empresa vendedora.",TIMO,es,apparel
93395,es_0744458,product_es_0132279,reviewer_es_0796986,3,"Tengo otra de Decathlon y me parece mucho mejor que esta. No es que sea mala mala, pero teniendo en cuenta que la otra no es mucho m치s cara y es mejor, esta no puede tener una alta puntuaci칩n. Adem치s, me pica durante la primera media hora y eso no me pasa ni me ha pasado con la otra que tengo. S칤 me pican unas mangas que me he comprado, algo que me parece importante mencionar porque mi piel es bastante sensible.",Aceptable si no exigimos mucho,es,apparel
53479,es_0290747,product_es_0143903,reviewer_es_0678747,2,El producto no lo he recibido aun,No recibir el producto,es,apparel
15415,es_0193885,product_es_0252820,reviewer_es_0506222,1,La cremallera trasera es de muy mala calidad. Compr칠 dos y en menos de 24 horas las dos cremalleras se rompieron,Mala cremallera,es,apparel
3541,es_0361902,product_es_0585387,reviewer_es_0452350,1,De momento ya se retras칩 2 semanas y sigue sin llegar. Sigo esperando... Y pongo una estrella de momento por que no deja poner 0. Cuando llegue si llega ya lo valorar칠.,No llega nada,es,apparel
69399,es_0068490,product_es_0510702,reviewer_es_0970541,2,Era tal cual se ve칤a en la foto.,Llego en perfecto estado. Espero que dure,es,apparel
101175,es_0639211,product_es_0951893,reviewer_es_0110316,3,"Es todo maravilloso excepto el bot칩 para quitarse el cintur칩n, hasta que no le pillas el truco las pasas canutas y as칤 y todo a veces tambi칠n cuesta.",Genial excepto el bot칩n,es,apparel
50290,es_0937847,product_es_0687033,reviewer_es_0586375,2,La verdad es que ha sido toda una decepci칩n. La tela no es nada del otro mundo y el tallaje es enorme. No lo recomiendo.,Queda super enorme,es,apparel
108206,es_0233203,product_es_0490609,reviewer_es_0777611,3,"La camiseta era para mi novio y le encanto, solo que la talla un poco grande Por lo dem치s todo bien entrega en el plazo esperado. Lo recomiendo!",Bien,es,apparel
109322,es_0002116,product_es_0145714,reviewer_es_0726713,3,"A ver, no esper칠is la mejor calidad del mundo, pero para lo que cuesta no est치 mal, aunque si lo que quieres es ir bien, no lo recomiendo, se nota que son baratos 游땐",M치s menos,es,apparel
42329,es_0388984,product_es_0262774,reviewer_es_0591394,2,"Tardo mas de 1 mes, pedi 3xl y es mas peque침a ademas despues del primer lavado (lavadora y secadora) encoje y despues del segundo lavado ya tiene un agujero,muy barato pero mala compra",Demasiado barata para ser buena,es,apparel
66026,es_0589281,product_es_0473644,reviewer_es_0646803,2,"Para sudoraci칩n poco o nada, m치s bien para evitar rozaduras con la camiseta.",Prontitud,es,apparel
3827,es_0741214,product_es_0568906,reviewer_es_0416857,1,No ha llegado todav칤a,Irresponsable,es,apparel
81162,es_0608796,product_es_0248580,reviewer_es_0625105,3,Calzo un 40 y me quedan un poco peque침os.,Muy bonitos pero muy poco el치sticos.,es,apparel
73021,es_0259757,product_es_0063882,reviewer_es_0559020,2,"Compr칠 estas gafas precisamente porque eran polarizadas, pero las que me han llegado no lo son, y no s칠 porqu칠.",He comprado unas gafas polarizadas y las que han llegado no lo son,es,apparel
9730,es_0635764,product_es_0147397,reviewer_es_0727858,1,El producton ha llegado rallado i en mal estado,Decepcionado,es,apparel
134122,es_0482481,product_es_0052771,reviewer_es_0998976,4,"Quiz치s no tenga la mejor calidad de materiales, no es cuero de verdad, pero el sistema sin agujeros ajusta mucho mejor, es mas elegante (춰adi칩s arrugas por las dobleces!) y mas r치pido, ya no quiero otro sistema.",El sistema de hebilla autom치tica es una gozada,es,apparel
148412,es_0693537,product_es_0607712,reviewer_es_0278528,4,Esta bien. Es caliente.,Buena calidad -precio.,es,apparel
89495,es_0385655,product_es_0733799,reviewer_es_0765062,3,Bueno pero mal material,Mal,es,apparel
69427,es_0625683,product_es_0594835,reviewer_es_0590608,2,La goma de la cintura se ha ensanchado a la primera puesta. Se me caen.,Goma cintura,es,apparel
31652,es_0374850,product_es_0889200,reviewer_es_0925412,1,"Es muy peque침o, yo compre una L, que hago M/l y me faltan casi 15cms de ancho",Esperando el reembolso,es,apparel
28688,es_0636210,product_es_0924173,reviewer_es_0472155,1,Esto se a perdio por el camino y no llega nunca lo compre hace mas de un mes vaya mierda de tienda,........,es,apparel
53945,es_0128881,product_es_0627436,reviewer_es_0097997,2,"La verdad es que me resultaba tan incomodo que no llegue ni a salir de casa con 칠l. La verdad es que pegaba mucho, pero no s칠 como hubiese sido un d칤a entero con 칠l",Incomodo,es,apparel
23299,es_0697056,product_es_0203431,reviewer_es_0801472,1,"Es enorme, mi bebe tiene 3 meses y todavia no se lo he podido poner, no s칠 porque pone reci칠n nacido cuando no es asi... y el gorro ya le va peque침o pero lo dem치s es grande",Horrible,es,apparel
53018,es_0107168,product_es_0053794,reviewer_es_0373672,2,Muy mala calidad se desconocido.,Muy mala calidad se desconocido,es,apparel
175303,es_0815989,product_es_0501974,reviewer_es_0745081,5,Buscaba una tardis para llevar y esta camiseta cumple perfectamente su funci칩n. La serigraf칤a es de calidad tambi칠n (se nota que es producto oficial de la BBC),Chul칤sima y de calidad,es,apparel
95135,es_0816431,product_es_0801601,reviewer_es_0977047,3,"Deberian modificar el t칤tulo de producto, ya que no son nada recomendables para ni침as porque el tama침o de la felpa es un poco grande y no son apenas el치sticas. Los colores si son muy similares a los de la foto de portada del producto.",Recomendable para mujeres,es,apparel
166190,es_0897480,product_es_0076900,reviewer_es_0750063,5,"Bonito dise침o, se adapta perfectamente y sienta muy bien... Rapidez en la entrega",Producto recomendado,es,apparel
67895,es_0499895,product_es_0929889,reviewer_es_0008772,2,Hay que pedir una talla m치s de la que se usa habitualmente. Demasiado peque침o,Peque침o,es,apparel
100832,es_0684502,product_es_0009946,reviewer_es_0741976,3,Es buena pero he tenido q sacarle las varillas q trae pero queda bien,Queda bien,es,apparel
90294,es_0754031,product_es_0146162,reviewer_es_0611480,3,No llegaba nunca y cuando lo reclame me tardaba un mes m치s en llegar as칤 que lo devolv칤 y tuve que reclamar varias veces el pago,Poco aconsejable,es,apparel
16605,es_0560922,product_es_0836339,reviewer_es_0964332,1,"Doy una estrella por dar algo. Un enga침o, al mes ya se pararon las agujas y la tuerca de q va a rosca se quedo encajada y era imposible mover las manillas para poner la hora. Un verguenza",Enga침o,es,apparel
169748,es_0935769,product_es_0305329,reviewer_es_0849120,5,"Est치n muy bien, peude parecer que las patillas son excesivamente blancas pero no lo son, tampoco el tono rojizo de los cristales.",Estupendas.,es,apparel
4575,es_0310312,product_es_0161127,reviewer_es_0536148,1,"El sujetador muy peque침o, he pedido una talla m치s, y la braga es enorme y el sujetador sigue siendo peque침o",Sujetador muy peque침o,es,apparel
190468,es_0979963,product_es_0870475,reviewer_es_0752808,5,"Los calcetines se ven de buena calidad, para mi gusto son perfectos, ni muy finos ni muy gordos, ideal para el verano, yo ped칤 mi talla y me vienen perfectos. La goma aprieta lo justo, no se caen pero tampoco te hacen marca. Recomiendo su compra.",Ideales para el verano,es,apparel
105091,es_0760467,product_es_0871560,reviewer_es_0082047,3,"Los guantes son c칩modos y suaves. La zona t치ctil no funciona del todo bien, teniendo que usar los bordes para manejar el m칩vil. No es muy preciso pero en caso de fr칤o basta para un uso puntual.",Funcional,es,apparel
