,review_id,product_id,reviewer_id,stars,review_body,review_title,language,product_category
135662,es_0273666,product_es_0809280,reviewer_es_0190232,4,Calcetines muy divertidos!ideal para regalo,Ideal para regalo,es,apparel
11386,es_0164873,product_es_0835559,reviewer_es_0373644,1,La foto est치 muy lejos de la realidad; es muy sencilla y el color nada que ver con el de la foto; la voy a devolver,Muy rea,es,apparel
158660,es_0542160,product_es_0322158,reviewer_es_0563526,4,La talla S me queda perfecta. Se ajusta muy bien al cuerpo y es muy calentito. Tiene detalles muy buenos como el ajuste de la capucha (que se puede quitar si se quiere) o el bolsillo interior para el reproductor de m칰sica y pasador para los auriculares.,Abrigo ajustado y calentito,es,apparel
76617,es_0756943,product_es_0906064,reviewer_es_0327544,2,El articulo no esta bien descrito y puede llevar a enga침o,Aventura,es,apparel
8325,es_0861225,product_es_0784813,reviewer_es_0069926,1,"Es super cutre, detr치s tiene dos tiras para que hagas un nudo en la espalda y otro en el cuello, no es el dise침o y estampado de la foto",Fatal,es,apparel
19651,es_0832259,product_es_0474338,reviewer_es_0401259,1,"Muy endebles s칩lo le han durado una semana. Ten칤a unas iguales de otro color de la misma marca que las perdimos eran muy buenas, por eso nos decidimos a comprar otras.",No resistentes a un Ni침o,es,apparel
153887,es_0327202,product_es_0065855,reviewer_es_0473505,4,Llegaron cuando ponia. Vienen 10 cintas de diferentes colores. Son muy bonitas y tama침o perfecto para mi hija de 8 a침os.,Buena calidad,es,apparel
2542,es_0313759,product_es_0725148,reviewer_es_0188188,1,"Doy una estrella por la respuesta r치pida del vendedor. Esto es una responsabilidad no se si por parte de Amazon o el propio vendedor. He pagado el env칤o urgente....y el mismo d칤a de recibirlo seg칰n el seguimiento del pedido me encuentro que hay problemas y se retrasa. Se solicita el reembolso del env칤o urgente me indican que la mitad me devolveran. No creo que vuelva a comprar, al menos a este vendedor. Ya veremos cuando lo recibo, si es que llega alguna vez.",La entrega urgente deja mucho que desear,es,apparel
30706,es_0667312,product_es_0650129,reviewer_es_0591292,1,Ni si quiera ha llegado,No llego,es,apparel
75537,es_0913294,product_es_0109738,reviewer_es_0411959,2,la tela es de muy mala calidad... es una tela 치spera y el negro no es tan oscuro. Esperaba mucho m치s en la foto. Sin embargo lo uso para hacer ejercicio.,no es para salir!,es,apparel
61712,es_0693233,product_es_0728458,reviewer_es_0503330,2,"La cajita es original pero el contenido es un poco escasos, lo quer칤a para un amigo invisible pero lo encuentro un poco cutre, yo me esperaba algo un poco m치s grande. La idea es original pero el producto es un poco escaso para lo que cuesta.",Original pero escaso,es,apparel
5972,es_0842499,product_es_0253776,reviewer_es_0737134,1,No he recibido producto ni aviso con fecha,No he recibido el producto ni me han abonado su coste muy decepcionado,es,apparel
11950,es_0645830,product_es_0830875,reviewer_es_0897557,1,"El aparato cumple mas o menos su funci칩n al generar presion inversa, pero esta se pierde f치cilmente tanto por la valvula como por el sello que hace contacto con la piel.",Falla v치lvula,es,apparel
78342,es_0050163,product_es_0735803,reviewer_es_0237678,2,"Pensaba que por la marca que es tendr칤a un poco m치s de calidad, es bastante fina y la parte del cuello a los hombros hace una forma que no acopla muy bien. Uso de camiseta interior.",Baja calidad,es,apparel
16497,es_0750254,product_es_0112806,reviewer_es_0642590,1,No me ha gustado este producto porque se ha roto la esquina de la funda en aproximadamente un mes. yo tenia un Apple que duro tres anos. precio este producto 13 euro y Apple 40 euro asi que me sale mucho mas caro este funda que Apple.,Mala calidad,es,apparel
170580,es_0590797,product_es_0341774,reviewer_es_0785106,5,Los tirantes son demasiado largos,Camiseta faja hombre,es,apparel
107987,es_0829002,product_es_0465338,reviewer_es_0332346,3,Pr치ctico y utilitario,C칩modo,es,apparel
98021,es_0779962,product_es_0795611,reviewer_es_0053759,3,"Lo ped칤 una talla mayor por los comentarios y acerte, Calidad muy justa terminaci칩n muy mejorable, Relaci칩n calidad precio no le puedes pedir m치s.",Lo que puedes esperar,es,apparel
138971,es_0734721,product_es_0252994,reviewer_es_0028348,4,"Con Vans nunca fallas, me sigue encantando la calidad de la ropa y sale m치s barato por Amazon que por propia pagina web",Camiseta de verano,es,apparel
91912,es_0553740,product_es_0588705,reviewer_es_0796150,3,Para andar por casa est치 bien,Caliente,es,apparel
41818,es_0785454,product_es_0267629,reviewer_es_0190963,2,"El volumen es bajo, el resto por el precio pues bueno....",El sonido es bajo,es,apparel
184770,es_0152027,product_es_0055284,reviewer_es_0207843,5,Es muy bonita y elegante,La puntualidad de entrega y buen material,es,apparel
134239,es_0541439,product_es_0954099,reviewer_es_0636074,4,ha llegado antes es la talla,perfecto,es,apparel
9620,es_0015132,product_es_0999569,reviewer_es_0430869,1,"Un desastre de vendedor y de producto, algo m치s malo no existe y las tallas son enormes..., el servicio postventa un desastre, como quieras descambiarlo sale m치s barato comprar otro. Compra para nada recomendada y menos para gente q esta acostumbrada a usar buenas badanas.",NO COMPRAR,es,apparel
29712,es_0580772,product_es_0697693,reviewer_es_0537428,1,Otro enga침o m치s. Ni s칠 dignaron en comprobar la talla que me mandaban. Un mes esperando para este timo. Me va a costar confiar otra vez en amazon,Ruben,es,apparel
69264,es_0973006,product_es_0506303,reviewer_es_0072004,2,Esperaba que fuera m치s grueso,Chaqueta,es,apparel
26364,es_0808920,product_es_0719694,reviewer_es_0607735,1,No es como parece en la foto,Talla muy grande,es,apparel
95500,es_0504181,product_es_0365831,reviewer_es_0530189,3,"La camisa me gusta pero es demasiado peque침a, no corresponde con la descripci칩n del tallaje. Se debe comprar una talla m치s pues la camisa es de corte muy ajustado. Est치 fabricada en China.La tuve que devolver pues me apretaba por la barriga.Es para personas delgadas.",Peque침a,es,apparel
66372,es_0657493,product_es_0971681,reviewer_es_0010865,2,La verdad es que antes hab칤a tenido camisetas de esta marca y la verdad es que estas no tienen la calidad esperada..,No es lo que esperaba,es,apparel
54545,es_0615175,product_es_0173474,reviewer_es_0995617,2,El interior de la caja no es de muy buena calidad y la corbata se ve peor en realidad que en las fotos. El acero usado es de baja calidad. Solo vamos a dar uso al pa침uelo.,Peor de lo que imaginaba,es,apparel
16915,es_0626976,product_es_0358960,reviewer_es_0006432,1,"Plazo de entrega bien como siempre, pero el color no tiene nada que ver con la foto no es lo que esperaba",Consu,es,apparel
73868,es_0129351,product_es_0972569,reviewer_es_0724037,2,"Valoraci칩n baja porque no se entiende que pidiendo dos unidades, que env칤an en el mismo sobre, cobren dos veces los gastos de env칤o.",Vale para lo que vale,es,apparel
163038,es_0190547,product_es_0368899,reviewer_es_0232323,5,Se los compr칠 para mi mujer y me dice k son bastante buenos. Super c칩modos. Por ahora solo los prob칩 de manera espor치dica ya que a칰n no hace tiempo para ponerlos todo el d칤a. Buena compra,Super comodos,es,apparel
152419,es_0091993,product_es_0323744,reviewer_es_0967952,4,"Tal como pensaba, perfecto para los dias de frio, buen material y relacion calidad y precio aceptable,buena compra, recomendable .",Aceptable,es,apparel
101829,es_0710254,product_es_0429617,reviewer_es_0966521,3,"Me cog칤 la talla justa y quedan genial. Estoy encantada, no se arrugan y se quedan puestas en su sitio.",Talla exacta y producto genial,es,apparel
166967,es_0940355,product_es_0882386,reviewer_es_0472314,5,Viene. Muy bie. Tanto en talla como el color muy aconsejable,Viene perfe ta de talla y color,es,apparel
144393,es_0553366,product_es_0810134,reviewer_es_0756552,4,"El producto parece de calidad solo que la talla es muy peque침a, ped칤 una L y es como una S.",Camiseta,es,apparel
150712,es_0164258,product_es_0123129,reviewer_es_0855981,4,"Es bonita la funda y ha gustado mucho a todo el mundo, pero para el uso del d칤a dia, quiz치s resbale un poco al sujetarla, sobre todo para escribir. Tambi칠n la recib칤 en el tiempo acordado.",Me ha gustado el color.,es,apparel
180818,es_0445747,product_es_0153363,reviewer_es_0669161,5,"Buen tacto. La talla correcta. En la foto parece m치s rosa, pero es blanco y marr칩n",Correcto,es,apparel
11288,es_0035453,product_es_0950338,reviewer_es_0298235,1,"P칠sima calidad de la tela, las medidas no coinciden, por muy barato que sea, es tirar el dinero. No lo compres",Rosa,es,apparel
42215,es_0432753,product_es_0518847,reviewer_es_0788792,2,"PEQUE칌O PARA EL TALLE, CORTE RIDICULO COLOR FEO, CLARAMENTE NO ES ORIGINAL, NO ES UN LEVIS, PARECE DE LOS CHINOS CON ETIQUETA DE LEVIS, NO ES EL MODELO ( LO CONOZCO EL DE LEVIS COMPRADO EN TIENDA FISICA) LO DEVOLVI.",NO ES ORIGINAL,es,apparel
58706,es_0650673,product_es_0238111,reviewer_es_0410651,2,"La calidad es buena, pero el ajuste es malo. Las bandas laterales son gruesas y quedan despegadas de la cabeza, por mucho que ajustes la hebilla. No la volver칤a a comprar, ni la recomiendo.","Buen material, mal ajuste",es,apparel
33293,es_0177813,product_es_0430475,reviewer_es_0261007,1,"Parecen c칩modas pero me ha llegado una de cada talla. Una m치s peque침a que la otra. Para un 42, una me iba muy justa y la otra no entraba. Las he devuelto",Llegaron con diferentes tama침os,es,apparel
70067,es_0555581,product_es_0509964,reviewer_es_0326031,2,"Para lo que valen estan mal cosidas por los pies, eso se puede romper wn cualquier momento, y no me a gustado nada que un carton estuviese dentro de una media porque asi se presta, aun no me las e probado pero se ven bien, y estaban bien empaquetadas",Los pies mal cosidos,es,apparel
99763,es_0565080,product_es_0689502,reviewer_es_0496730,3,"Tela bastante mala, fina...pero esta claro que por el precio que tiene no esperaba mucho m치s. El cintur칩n es para tirarlo directamente.",Cutrecillo pero ponible.,es,apparel
97833,es_0626902,product_es_0779249,reviewer_es_0335629,3,"Por lo que cuestan no se puede pedir m치s. Se me rallaron enseguida, pero para bajar a la playa me valen",Sencillas,es,apparel
59607,es_0769498,product_es_0211506,reviewer_es_0617566,2,"lo devolv칤 porque la hebilla es muy grande para mi gusto, no me parec칤a tanto en la foto, pero al probarlo me resultaba molesto al sentarme, por lo dem치s se ve de buena calidad y es de piel.",hebilla muy grande,es,apparel
158005,es_0919953,product_es_0271092,reviewer_es_0647658,4,"Muy buena carcasa protege bien el tel칠fono la pega que le veo esque es un poco resbaladiza,por lo dem치s muy contenta",Buen producto,es,apparel
83040,es_0148762,product_es_0525422,reviewer_es_0768113,3,lo pedi para que le quedase un poco grande y le quedaba peue침o pero me lo cambiaron sin ning칰n problema,la talla som peque침as,es,apparel
165340,es_0575788,product_es_0189731,reviewer_es_0274796,5,Cumple con la calidad... Lo recomiendo.,Buena compra,es,apparel
28004,es_0072522,product_es_0414514,reviewer_es_0456920,1,He pedido la pajarita y pa침uelo fucsia y me han enviado el morado. Incluyo una foto sobre una camiseta rosa para que se aprecie mejor.,Color diferente al solicitado,es,apparel
192982,es_0607859,product_es_0108279,reviewer_es_0745840,5,Diversidad de colores,Buen producto y r치pida entrega,es,apparel
129879,es_0389590,product_es_0735302,reviewer_es_0048253,4,Todo correcto y se ajusta a la descripcion del producto,Relacion precio calidad,es,apparel
75179,es_0041916,product_es_0296009,reviewer_es_0740998,2,"De est칠tica est치n bien, pero solo es eso... Las limpie el otro d칤a y una de las l치minas se sali칩 de las gu칤as de la lente y no ha habido manera de volver a ponerlas correctamente....",Me han defraudado.,es,apparel
77045,es_0176810,product_es_0309134,reviewer_es_0838821,2,Ped칤 un pack de la talla M pero uno de ellos era de la talla S. Una molestia absolutamente innecesaria.,Uno de los slips del pack era de otra talla,es,apparel
101090,es_0374404,product_es_0875341,reviewer_es_0678023,3,Todo ok por el precio,Aceptable,es,apparel
63918,es_0966059,product_es_0888043,reviewer_es_0589426,2,Un poco cutre el grabado de Harley,No es lo que esperaba,es,apparel
33034,es_0125889,product_es_0440597,reviewer_es_0779278,1,"Muy grande para la talla que pedi, de calidad mal칤sima no es lo que parece en la foto",No la recomiendo,es,apparel
76000,es_0577814,product_es_0603836,reviewer_es_0572252,2,"Son un poco peque침as, me hacen un efecto raro en la visi칩n.",Peque침as calidad dudosa,es,apparel
34213,es_0006646,product_es_0187828,reviewer_es_0564255,1,"Lo ped칤 el 17 de junio, estamos a 26 de julio y no me ha llegado, al igual me lo puedo poner para diciembre.... He pedido que me devuelvan el dinero pero ni dinero ni pedido.",Desastre,es,apparel
77863,es_0043915,product_es_0729960,reviewer_es_0110988,2,"Creo q da un talla mas de la q es, de todas formas la devolvimos pq la tela era muy fina.",La devolvi pq la tela me parecio muy fina,es,apparel
115338,es_0666299,product_es_0489204,reviewer_es_0810714,3,Muy c칩modas y discretas pero se rompen muy facilmente.,Recomiendo,es,apparel
100979,es_0218249,product_es_0069730,reviewer_es_0298112,3,Cintur칩n normal. Hace su funci칩n y cost칩 poco,Bien,es,apparel
23022,es_0060171,product_es_0972977,reviewer_es_0953220,1,"Nunca me han llegado estuve esperando dos meses y se han perdido por el camino, no me atrevo a comprarlas otra vez pero el vendedor me a reembolsado el dinero y siempre he tenido respuesta y nunca me ha puesto ninguna pega.",Se a perdido por el camino,es,apparel
36203,es_0034111,product_es_0616482,reviewer_es_0175426,1,La caja ven칤a abierta y uno de los calzoncillos mal doblado y con una mancha. Parec칤a como si alguien se lo hubiese probado. Bastante desagradable y poco serio.,Mercanc칤a usada?,es,apparel
194681,es_0636795,product_es_0240996,reviewer_es_0823407,5,Mi mujer encantada le gust칩 mucho,Satisfecho,es,apparel
119849,es_0997540,product_es_0710138,reviewer_es_0298065,3,"Est치n bien, pero la tela es m치s fina de lo que esperaba. No obstante,no edtan mal y por ese precio,menos",Precio,es,apparel
73690,es_0471605,product_es_0208881,reviewer_es_0604082,2,"Los tornillos posteriores sobresalen demasiado, pueden rayar la lente!",Pueden rayar la lente.,es,apparel
52051,es_0707436,product_es_0952666,reviewer_es_0479403,2,La verdad es que mucho no me gusta. A칰n no lo he estrenado porque no me gusta como queda. Seguramente es que yo no tengo el Cuerpo de la modelo de la foto,Defraudada,es,apparel
174359,es_0917888,product_es_0620040,reviewer_es_0574208,5,"Se incluyen 2 mallas. Una en color negro y la otra en color morado. La talla es 칰nica, yo uso una 42 me quedan perfectas. Son ideales para el invierno, ya que por dentro son de forro polar que las hacen super calentitas y suaves.",Muy calentitas !!,es,apparel
77364,es_0990712,product_es_0826353,reviewer_es_0602300,2,"El tejido se transparenta bastante y aunque parezcan el치sticos no lo son, una vez me los he puesto y no m치s... Dinero malgastado.",Malgasto,es,apparel
124013,es_0586952,product_es_0164398,reviewer_es_0568681,4,"funda de buena calidad, cumple las expectativas",cumple expectativas,es,apparel
40981,es_0640875,product_es_0487108,reviewer_es_0273423,2,A veces se te bajan al andar y la resulta es una ampolla chachi. El precio sin embargo esta bien,50/50,es,apparel
16571,es_0943159,product_es_0897818,reviewer_es_0081659,1,"Este sujetador no sujeta nada, se cae nada m치s ponerlo, no hace la funci칩n de sujetar precisamente. No lo recomiendo para nada.",Un horror,es,apparel
132222,es_0254036,product_es_0117723,reviewer_es_0207045,4,"El tejido es como el de una media tupida, pensaba que ser칤a m치s tejido de malla de algod칩n. Pero igualmente me sirve para estar por casa y para hacer yoga.",util para casa,es,apparel
142738,es_0597885,product_es_0935307,reviewer_es_0596542,4,"El abrigo es cojonudo pero da mucha talla, yo me compr칠 una M y parec칤a XL, lo tuve que devolver.",Muy grande,es,apparel
168064,es_0803959,product_es_0118119,reviewer_es_0069636,5,Fue para un regalo as칤 que solo puedo confirmar que le encant칩. Los colores y el tacto perfectos.,Muy bonito.,es,apparel
20876,es_0369503,product_es_0139070,reviewer_es_0518543,1,"No llega hasta el suelo, yo mido 1.68 y ped칤 una talla m",Corto,es,apparel
16168,es_0682687,product_es_0385039,reviewer_es_0170178,1,"La calidad de la goma el치stica es muy mala, en apenas un par de meses se ensancha y se vuelven inservibles. No los recomiendo.",Muy mala calidad en la goma el치stica,es,apparel
43878,es_0735775,product_es_0009758,reviewer_es_0921194,2,No me lleg칩 el paquete. Pero me devolvieron el dinero al momento.,Buen servicio,es,apparel
109640,es_0206480,product_es_0830443,reviewer_es_0705668,3,Los calcetines est치n bastante bien.,Calidad precio est치n bien,es,apparel
62450,es_0226838,product_es_0964856,reviewer_es_0249401,2,"Calidad buena pero precio muy caro para dos baberos que me llegaron,el dise침o es bonito pero no merece la pena . No lo recomiendo",Solo llegaron dos baberos de 4 que dice traer,es,apparel
47549,es_0492556,product_es_0369912,reviewer_es_0718107,2,No se corresponde con las medidas. Es enorme.,Talla grande,es,apparel
109352,es_0745936,product_es_0992262,reviewer_es_0685749,3,Gafas de calidad media ... Ni buenas ni malas,Mediocres,es,apparel
68780,es_0618651,product_es_0802596,reviewer_es_0703717,2,Bonita sombrilla pero algo peque침a . El mango se queda muy corto y tenemos que levantar mucho el brazo para taparnos con el . So lo har칤a un poco mas grande y el mango mas largo. tal y como viene parece que es para mu침ecas.,SOMBRILLA BONITA PERO PEQUE칌A,es,apparel
197834,es_0005930,product_es_0406904,reviewer_es_0187651,5,Es muy chula y parece piel. Queda ideal con cualquier abrigo,Efecto piel,es,apparel
104708,es_0950225,product_es_0956626,reviewer_es_0269271,3,gorra llega en perfecto estado...igual que la que anuncian...pero viene para gente con cabezas bastante grandes...aunque se puede regular se arruga un poco por detras...pero muy bonita,bonita pero algo grande..,es,apparel
33703,es_0807914,product_es_0124082,reviewer_es_0176107,1,"Aunque era mi talla me quedaba muy justo por arriba y el largo no me acababa de gustar, as칤 que lo devolv칤",No me acaba de gustar del todo,es,apparel
24580,es_0006897,product_es_0568743,reviewer_es_0019840,1,P칠sima calidad. A los pocos d칤as se han partido los marcos en ambas gafas.,Mal칤sima calidad,es,apparel
66835,es_0557673,product_es_0158218,reviewer_es_0994551,2,"La tela esta como electrificada, se te pega al cuerpo y queda bastante raro, la devolv칤 porque no era como esperaba",La tela se pega demasiado,es,apparel
48706,es_0144816,product_es_0732132,reviewer_es_0960539,2,"Est치 muy bien hecho y parece fuerte y resistente, pero ped칤 una copa B y me queda muy muy peque침o, lo voy a regalar, no lo cambio porque creo que ni una copa m치s grande me estar칤a bien.",Muy peque침o,es,apparel
170597,es_0495400,product_es_0014991,reviewer_es_0321094,5,"Muy ultil, buen material y c칩modos",Correa gafas neopreno,es,apparel
73147,es_0265974,product_es_0630919,reviewer_es_0739412,2,"Los guantes son muy calentitos pero lo t치ctil no funciona adecuadamente. Rara vez hace su funci칩n. La parte anti deslizante funciona m치s o menos bien con fundas de silicona o material que se pueda adherir bien, sino no funciona. El tama침o de los guantes se suele corresponder con una talla M/L, no son muy muy grandes.",Guantes NO t치ctiles,es,apparel
181809,es_0104238,product_es_0310484,reviewer_es_0586369,5,"Los calcetines son muy comodos, son de entretiempo ( primavera - verano ), lo que si se nota y mucho es que al primer lavado se han encogido bastante, no he notado perdida de comodidad al volver a ponermelos, pero a simple vista pierden una tercera parte de su tama침o.",COMODOS,es,apparel
154009,es_0665695,product_es_0516630,reviewer_es_0662615,4,"Son calcetines muy c칩modos, suaves, la unica pega que tengo es que al lavarlos van perdiendo tela, pero como todas las ropas, van perdiendo calidad a medida en que la lavas, pero funcionan de maravilla ya que tienen malla.",Muy buenos,es,apparel
130082,es_0133998,product_es_0391276,reviewer_es_0598086,4,"Muy buenas , se nota much칤simo mo polarizado",Perfecta,es,apparel
121535,es_0069144,product_es_0833097,reviewer_es_0096487,4,"Buenos colores, y tambi칠n muy c칩modos, si acaso un poco m치s peque침os que lo que esperas de una talla M.",Quedan muy bien,es,apparel
110279,es_0471908,product_es_0921383,reviewer_es_0137564,3,Las tallas no son europeas. Calidad precio bien.,Buen precio,es,apparel
195905,es_0048041,product_es_0487413,reviewer_es_0787218,5,No lleg칩 a칰n y no han devuelto el dinero,No ha llegado y no han devuelto el dinero,es,apparel
186175,es_0529165,product_es_0393989,reviewer_es_0389058,5,Tal cual viene en descripci칩n. Queda ajustado. Lleg칩 antes de lo previsto,Vestido simple pero elegante. Entrega muy r치pida,es,apparel
99284,es_0150731,product_es_0021457,reviewer_es_0251201,3,"En foto sale con capucha, en realidad no tiene",Albornoz,es,apparel
64302,es_0126328,product_es_0073977,reviewer_es_0637549,2,esta bien de talla y de dibujo pero se transparenta,se transparenta,es,apparel
152221,es_0919909,product_es_0157808,reviewer_es_0627232,4,Rompo cuellos en la piscina,Rompo cuellos en la piscina,es,apparel
94564,es_0062799,product_es_0444990,reviewer_es_0957625,3,"Prefiero grande que no peque침o. Las medidas no son como est치n escritas pero a칰n as칤, me lo pongo",Original,es,apparel
19559,es_0028086,product_es_0655122,reviewer_es_0256336,1,Todav칤a no me ha llegado. Y pone que est치 entregado.,No me ha llegado,es,apparel
158957,es_0575996,product_es_0902215,reviewer_es_0705802,4,No hay ninguna pega la verdad las gafas que esperaba en el precio y el tiempo que esperaba. encantada gracias,Genial,es,apparel
170537,es_0304625,product_es_0476764,reviewer_es_0348891,5,Igual que en la descripci칩n,*,es,apparel
59756,es_0095085,product_es_0033756,reviewer_es_0475361,2,"Los necesitaba para que mi hijo realizara unos trabajos de manualidades en el colegio, y cumplieron con su funci칩n, pero como pa침uelos de uso normal no los recomiendo, ya que son muy finos y la calidad no es demasiado buena. Adem치s algunos de ellos llegaron rotos. Por otra parte tuve problemas con su entrega. No recomiendo este producto a no ser que lo quieras para algo puntual y para un uso muy distinto al que realmente van destinados.",Mala calidad si los necesitas como pa침uelos de uso normal,es,apparel
177436,es_0759082,product_es_0880661,reviewer_es_0839362,5,"Buena calidad, algo entallada.",Buen producto,es,apparel
98627,es_0638881,product_es_0305271,reviewer_es_0403185,3,Pagas de m치s por la marca. Algodon que pronto se da de si. El blanco enseguida se pone gris.,No es la calidad que esperaba.,es,apparel
161380,es_0943161,product_es_0970478,reviewer_es_0007716,5,Todo perfecto. Me encanta esta marca de ropa. La camiseta me queda bien de talla. Recomendado. Est치s ofertas no se pueden dejar escapar.,Ropa de buena calidad,es,apparel
111823,es_0424345,product_es_0961673,reviewer_es_0863774,3,La tela es un poco fina. Pero relaci칩n calidad precio es buena,Es un dise침o bonito.,es,apparel
37953,es_0387170,product_es_0025493,reviewer_es_0440891,1,No me gust칩! Huele muy fuerte y no se va el olor,No me gusto,es,apparel
19059,es_0891599,product_es_0106153,reviewer_es_0620216,1,No es el mismo de la foto es una gorra. El nombres est치 bien.,Foto equivocado.,es,apparel
87539,es_0303186,product_es_0238212,reviewer_es_0673902,3,"Muy chula, pero un poco peque침a, pero me la cambiaron, muy atentos todos. Los vendedores.",Muy bonita,es,apparel
124563,es_0021700,product_es_0295164,reviewer_es_0961419,4,"Algo chico el plug y si se lubrica bien, cuesta que no se salga. A칰n as칤, c칩modo para jugar y por un precio muy razonable.",Muy bien,es,apparel
181683,es_0581590,product_es_0588153,reviewer_es_0473623,5,"buena visi칩n con ellas , rigidas , ya he comprado dos de la misma marca.",gafas de sol,es,apparel
71549,es_0815504,product_es_0157502,reviewer_es_0069975,2,"El material es bueno, al momento de la publicaci칩n en el precio del env칤o y manipulaci칩n es muy costoso no lo aclaran como debe ser.",Body,es,apparel
195633,es_0208623,product_es_0999623,reviewer_es_0017179,5,"Ideal para ir a la playa o a la piscina, tela translucida, y de facil secado.. Al llevar flequillos queda tipo vestido... Y se puede poner caido al hombro tambien.. Yo estoy muy contenta, no me a disgustado nada.",Vestido piscina/playa,es,apparel
129051,es_0053200,product_es_0310573,reviewer_es_0259607,4,Buena calidad y buen tacto,Muy divertidos,es,apparel
117019,es_0820262,product_es_0877613,reviewer_es_0407155,3,Quizas el color no se ajusta del todo a la realidad.,Color,es,apparel
119964,es_0497113,product_es_0981904,reviewer_es_0905571,3,"Algo peque침o pero bien por el pecio, aceptable",Aceptable,es,apparel
17620,es_0122085,product_es_0265191,reviewer_es_0194195,1,He recibido CAJA Vacia. Solo con prospecto. Un folio y un prospecto para que aprenda a enrollarlo. Lo peor es que no se donde reclamar.,Caja sin sombrero,es,apparel
72361,es_0931825,product_es_0245639,reviewer_es_0677288,2,Es muy bonito y de talla perfezto pero en la primera puesta la cremallera se rompio no dura nada lo tube q llebar a arreglar,No es de buena calidad,es,apparel
