,review_id,product_id,reviewer_id,stars,review_body,review_title,language,product_category
149103,es_0204030,product_es_0954077,reviewer_es_0423061,4,corresponde a la descripci칩n,Correcto,es,apparel
155095,es_0162799,product_es_0896478,reviewer_es_0921658,4,"Bastante buena relaci칩n calidad/precio, creo que son pr치cticos y como se pueden atar, creo que se pueden usar por cualquiera","Parece buen material y f치ciles de limpiar, a mi me han gustado, aunque son diferentes uno de otro",es,apparel
6716,es_0356493,product_es_0477839,reviewer_es_0582692,1,Muy descontenta por que me urg칤a y me llegaron dos copas derechas asi que no me vale para nada...,Mal...,es,apparel
20108,es_0040557,product_es_0534667,reviewer_es_0021807,1,Llegan solo tres de tres tallas diferentes,Estafa en el pack,es,apparel
105484,es_0421624,product_es_0823330,reviewer_es_0104440,3,SE VE M츼S BONITO EN LA IMAGEN,SE VE M츼S BONITO EN LA IMAGEN,es,apparel
109516,es_0103982,product_es_0987062,reviewer_es_0424949,3,"Esta bien y tiene calidad,solo que son muy peque침os",Es bonito y tiene calidad,es,apparel
103307,es_0535945,product_es_0419588,reviewer_es_0827447,3,"Se rompi칩 la cremallera, al estrenarlo. Con lluvia cala los calzoncillos al sentarme en la moto. Los uso en scooter por ciudad, por lo que les he quitado las protecciones. Para mi uso van bien por lo que si los recomiendo.",Producto aceptable,es,apparel
13468,es_0231324,product_es_0818688,reviewer_es_0683825,1,No se si grandes o peque침os ni calidad ni si son bonitos nunca me llegaron y no responden no es de fiar para compras,No llego,es,apparel
120139,es_0883034,product_es_0438450,reviewer_es_0781561,4,Muy buena calidad precio,Como esperaba,es,apparel
113182,es_0543641,product_es_0703599,reviewer_es_0506215,3,"El tallaje no es el correcto, se pidieron tomando como referencia la tabla de tallas del vendedor y los guantes no dan esa talla.",Dan poca talla,es,apparel
34608,es_0092319,product_es_0289467,reviewer_es_0969769,1,"Las compr칠 para un regalo, cuando le칤 las opiniones me parecieron buenas... Primero, no me llegaron a tiempo, pero no me caus칩 problema porque ten칤a d칤as de margen. Lo m치s importante es la funcionalidad... cuando conduce ve un destello desde el retrovisor que se refleja en el parabrisas del de detr치s y para ver el display de la pantalla del coche se las tiene que quitar... en fin, las hemos devuelto.",No son lo que esperaba,es,apparel
126740,es_0122040,product_es_0460554,reviewer_es_0135929,4,"Buena calidad , dise침o perfecto","Muy bien, buena calidad y bonito dise침o",es,apparel
187663,es_0911817,product_es_0534667,reviewer_es_0887289,5,Lo 칰nico que no me gust칩 es que la parte del cuello es apretada,Bien,es,apparel
76744,es_0591754,product_es_0433480,reviewer_es_0349298,2,"No ha durado un a침o. Es para exteriores, pero no aguanta el sol o la intemperie, est치 destrozada",No aguanta bien la intemperie,es,apparel
127229,es_0636039,product_es_0885527,reviewer_es_0976420,4,"El saco es muy c칩modo, ligero y de tejido c치lido. La talla se corresponde con el tama침o del bebe. Lo recomendar칤a sin duda. El dise침o es sencillo.",Buena relaci칩n calidad-precio,es,apparel
68066,es_0931118,product_es_0409013,reviewer_es_0244389,2,Demasiado grande para lo que necesitaba (aunque vengan medidas...me equivoqu칠..)pero no est치 nada mal.buena piel y acabado.color marron bonito .,Cristina Vicente,es,apparel
23889,es_0448278,product_es_0612850,reviewer_es_0104059,1,Se rallo la hebilla la tercera o cuarta vez que me lo puse. Un fake! al principio tenia buena pinta pero no dur칩 nada. Dinero tirado.,Una pena.,es,apparel
19268,es_0701408,product_es_0906821,reviewer_es_0946352,1,El color es blanco tirando se beige... Y la talla m치s bien peque침o,Camiseta,es,apparel
106484,es_0365729,product_es_0912822,reviewer_es_0544487,3,Si me ha gustado. Es muy bonito y original. Lo 칰nico la tela. Me gustar칤a que tuviera m치s algod칩n. Pero no se puede tener todo.,Bonito y original,es,apparel
152197,es_0180022,product_es_0308727,reviewer_es_0391150,4,"Polo cl치sico y sencillo de calidad normal, dise침o tradicional y muy buen precio. La tabla de tallas es perfecta!!!! Corresponde con la descripci칩n y expectativas",Polo cl치sico y sencillo.,es,apparel
65848,es_0659645,product_es_0757889,reviewer_es_0504606,2,"Pese a pedir una talla m치s de la normal , sigue quedando un poco justo. Tengo una 90 de pecho, 36 de pantal칩n y ped칤 una M. La parte de arriba junta el pecho , pero lo aplasta. Y la braguita es muy estrecha de la parte 칤ntima, y talle muy bajo. La calidad por el precio es aceptable.",L,es,apparel
33014,es_0252195,product_es_0241144,reviewer_es_0494372,1,"S칩lo con un dia de uso ya se hacen bolas. Tengo que probar el resto de calcetines (compr칠 6). De momento, muy decepcionado.",Mala calidad del producto.,es,apparel
112204,es_0382991,product_es_0103670,reviewer_es_0517294,3,"Var칤a m치s o menos una talla, yo uso la m, ped칤 la s y me queda algo grande. Por otro lado la tela es muy falsa (como de carnaval) y huele mucho a pl치stico. Yo le meter칠 un bien bolso, faj칤n o cintur칩n, buen maquillaje y peinado... Creo que bien combinado dar치 el pego. Si consigo sacarle partido adjunto foto.",No es exacto a la foto,es,apparel
178647,es_0660879,product_es_0317988,reviewer_es_0113192,5,Lo que menos me gusta es que los pompones que van en los botones no est치n cosidos sino que cada vez que se ata hay que ponerlos ( traen una goma para engancharlos a los botones). Ped칤 una talla 3-4 para una ni침a de 2 a침os y es su talla justa.,Bonito,es,apparel
149053,es_0000211,product_es_0415601,reviewer_es_0788190,4,Buena calidad precio,VBIGER Cintur칩n Lona,es,apparel
9312,es_0135857,product_es_0694395,reviewer_es_0167843,1,Mala no p칠sima calidad.. En menos de un mes se a roto por varias partes tal es as칤 que la tengo pegada con cinta de doble cara,Una pena de materiales,es,apparel
50955,es_0581571,product_es_0484864,reviewer_es_0013726,2,"La tela es muy fina, y aunque sujeta, no moldea lo necesario, y se siguen marcando las carnes igual que sin ella",No aprieta tanto,es,apparel
59212,es_0610068,product_es_0076646,reviewer_es_0705548,2,"Si lo que quieres son unas gafas de moda, comprarlas, pero creo que los cristales no son de calidad","A la moda, pero poca calidad 칩ptica",es,apparel
173941,es_0133877,product_es_0383438,reviewer_es_0132954,5,La gorra est치 muy guapa y es muy c칩moda,Muy buena,es,apparel
132568,es_0712614,product_es_0204410,reviewer_es_0542922,4,Muy bien y justo para lo que me hac칤a falta.,Brutal,es,apparel
28809,es_0086094,product_es_0215938,reviewer_es_0759703,1,Distorsionan la imagen. Solo para llevarlas poco rato.,No recomendada,es,apparel
192641,es_0998114,product_es_0766865,reviewer_es_0272803,5,Llevo usando el cintur칩n hace unas 2 semanas. Me encanta el sistema de cierre. Gran calidad del material y la hebilla negro mate luce muy bien. Por comprar uno marr칩n ahora mismo. :),Excelente calidad y el sistema de cierre,es,apparel
175180,es_0322297,product_es_0606756,reviewer_es_0612129,5,Los compramos porque nos los recomendaron unas enfermeras y nos han ido genial.,Calcetines,es,apparel
130266,es_0876407,product_es_0294264,reviewer_es_0034435,4,Queda un poco m치s justo de lo que esperaba pero el tacto es genial. Queda parecido al de la foto. Se le puede dar much칤simo uso.,Est칤baliz,es,apparel
196857,es_0867843,product_es_0977489,reviewer_es_0728562,5,Me encantan se ve my bien y el dise침o estupendo.esta muy bien,Se ve muy claro,es,apparel
61329,es_0988444,product_es_0277157,reviewer_es_0597280,2,No he notado mucha diferencia!,Decepcionante,es,apparel
35691,es_0996386,product_es_0839308,reviewer_es_0416579,1,"Un timo,no env칤a nada y Amazon no hace nada.",Enga침o,es,apparel
101862,es_0226653,product_es_0861148,reviewer_es_0394942,3,Ten칤a una camiseta igual hace diez a침os y era de mucha m치s calidad. Esta pone que es 100% algod칩n pero al tacto no lo parece. Talla muy grande.,Calidad media-baja,es,apparel
38477,es_0445180,product_es_0710138,reviewer_es_0085444,1,"La textura no es muy elastica, y se transparenta. Me quedan bien de talla pero muy cortos.",Regular.,es,apparel
45221,es_0738654,product_es_0459763,reviewer_es_0019672,2,Me encanta este modelo de Ray-Ban pero su acabado en plasticucho me hace dudar incluso de si son originales el par que he recibido,plasticucho,es,apparel
36932,es_0928440,product_es_0474475,reviewer_es_0206865,1,Este producto en concreto a칰n no me ha llegado. El resto de los pedidos que hice el mismo d칤a s칤.,No me ha llegado,es,apparel
113625,es_0511051,product_es_0771102,reviewer_es_0661395,3,Calidad/ precio aceptables,Bien,es,apparel
128043,es_0255270,product_es_0338368,reviewer_es_0939039,4,"Por precio, buen producto. No es 100% como se ve el color en la foto y la tela es algod칩n, no es el치stica. Se ajusta bien al cuerpo. Ante la duda entre dos tallas, cojer la menor.",Contenta con el resultado,es,apparel
37618,es_0374396,product_es_0455995,reviewer_es_0417405,1,No lo se no lo he recibido. No me ha llegado el pedido para cuando va a llegar el articulo,El producto,es,apparel
163649,es_0086298,product_es_0337362,reviewer_es_0699039,5,Muy contenta con la compra. Buena calidad.,Buena compra.,es,apparel
156554,es_0464856,product_es_0292138,reviewer_es_0518734,4,Son preciosos y de buena calidad. Con un tama침o perfecto. No le doy 5 estrellas porque tardaron bastante en llegar. Por lo demas muy contenta,Recomendados,es,apparel
99242,es_0822090,product_es_0816465,reviewer_es_0492595,3,"bien y c칩modos, quiz치s algo finos, para mi gusto, deber칤an tener m치s cuerpo",calcetines,es,apparel
162200,es_0631334,product_es_0514595,reviewer_es_0291645,5,"El producto corresponde s la descripci칩n del vendedor , es bonito y de muy buena calidad. Compre una talla mas grande de lo normal y queda bien.",Bonito,es,apparel
20421,es_0918979,product_es_0979722,reviewer_es_0104229,1,Todav칤a no lo he recibido,"Envio lento, todav칤a no lo he recibido",es,apparel
73599,es_0940329,product_es_0058072,reviewer_es_0027814,2,No es tan bonito como parece. Pero no da picor el tejido. No sujeta nada as칤 que s칩lo es decorativo.,Regular,es,apparel
11596,es_0381470,product_es_0124898,reviewer_es_0770085,1,"La aleta de pl치stico se rompi칩 enseguida, muy mala calidad. No quedamos nada contentos. La talla era correcta para la edad",Se rompi칩,es,apparel
30129,es_0707559,product_es_0503897,reviewer_es_0315401,1,La calidad muy mala con dos lavados se han agujereado no lo recomiendo,Mala calidad,es,apparel
151547,es_0657117,product_es_0147389,reviewer_es_0850867,4,"Sientan muy bien y son de muy buena calidad, La calidad es incluso mejor que lo que se ve en la foto",buena relacion calidad precio,es,apparel
70903,es_0462287,product_es_0956395,reviewer_es_0107977,2,"El vestido para que quede bien es para alguien con mucho pecho. Es demasiado amplio para el largo q tiene, necesita forro debajo de la falda y se abre constantemente sal caminar",No sienta bien si no tienes mucho pecho,es,apparel
161168,es_0193879,product_es_0093480,reviewer_es_0985957,5,Perfecto y buena calidad,Buena compra,es,apparel
22738,es_0472272,product_es_0392470,reviewer_es_0137730,1,La XXL es demasiado peque침a,Talla peque침a,es,apparel
145834,es_0404478,product_es_0602828,reviewer_es_0052151,4,"Buenos pa침uelos para ni침os con dibujos alegres, tal y como los recordaba de mi infancia, y que no habia vuelto a ver.",Buenos pa침uelos,es,apparel
124024,es_0132884,product_es_0211462,reviewer_es_0276922,4,"M치s que un abrigo es un chubasquero. Algo abriga pero mejor llevarlo puesto con ropa gruesa debajo. A칰n as칤, es ligero y como protector contra la lluvia es muy adecuado.",Est치 bien,es,apparel
112716,es_0945858,product_es_0605695,reviewer_es_0747112,3,El tama침o es el correcto pero almenos a mi me aprieta d las gomas . Se ve buen material espero a ver si se dan un poco,Buen material pero apretan,es,apparel
149973,es_0147572,product_es_0377410,reviewer_es_0910533,4,"La calidad es muy buena, pero ojo! Que brilla mas que el sol! Si es lo que estas buscando genial, yo cre칤a que ser칤a mas mate pero no. Se adapta genial al cuello y no le fu칠 nada molesta a mi hijo.",Pajarita brillante,es,apparel
188382,es_0091722,product_es_0141784,reviewer_es_0375629,5,"Queda bien puesto, la talla tambi칠n est치 bien un Pek칤n grande pero lo prefiero a que quede peque침o, es dif칤cil acertar con esos tallajes pero queda bien puesto",Bien,es,apparel
90802,es_0873758,product_es_0229755,reviewer_es_0207875,3,Es bonito pero cuesta mucho volver a recuperar su forma una vez lo pliegas. Necesita mucha plancha y a칰n as칤 no queda perfecto nunca,Regular,es,apparel
36121,es_0635902,product_es_0754751,reviewer_es_0254037,1,"Lo he devuelto porque el material del cintur칩n es pobre, el acabado no me parec칤a de suficiente calidad.",Calidad inferior,es,apparel
121434,es_0226609,product_es_0585427,reviewer_es_0418124,4,Me gusto el producto,游,es,apparel
71037,es_0021137,product_es_0683084,reviewer_es_0533942,2,Muy muy finos y peque침os para un 45.,peque침itos.,es,apparel
51883,es_0326719,product_es_0347646,reviewer_es_0184767,2,Encaja perfectamente y es muy bonito pero en las uniones de las dos partes de la tapa se est치 rompiendo y la parte trasera se ensucia muy f치cil,Regular,es,apparel
154827,es_0212500,product_es_0405424,reviewer_es_0945681,4,"Es bueno y grande, pero ojo, motor de aire es peque침o y dentro te puedes cocer de calor, al m칤o se le ca칤a el ventilador pero lo solucion칠 con una brida. Lo recomiendo.",Buen disfraz,es,apparel
81758,es_0292152,product_es_0532803,reviewer_es_0869486,3,"Es muy f치cil de colocar y aporta una protecci칩n extra a la pantalla, muy 칰til para practicar deporte (en mi caso, ciclismo). Inconveniente: se pierde bastante sensibilidad en la pantalla.",Sencillez !!!,es,apparel
46163,es_0549039,product_es_0926327,reviewer_es_0606983,2,"es de muy mala calidad, no tiene tull vaporoso como la foto y no se parece en nada. es una porqueria",Nada que ver con la foto,es,apparel
165532,es_0566689,product_es_0802965,reviewer_es_0707593,5,"Me queda genial el art칤culo , y son muy responsables con los cambios de art칤culos . Estoy muy feliz por la compra",Excelente,es,apparel
153423,es_0628288,product_es_0473361,reviewer_es_0330207,4,"Recibidos rapidamente,llegaron dos pares como se anuncian,los calcetines estan bien confeccionados,pedi una talla 38-42 tengo un 42 y me quedan correctos y apretaditos,los calcetines pintan bien pero en este caso para mi que los queria usar para hacer TAICHI no me valen pues me frenan bastante con el contacto en el suelo,no obstante mi hermana que tiene un 38 se los he regalado y dice que le vienen genial para hacer pilates.asin que buena compra sobre todo para mi hermana jejeje,,,saludos",Correctos,es,apparel
142487,es_0495629,product_es_0317664,reviewer_es_0020420,4,Son originales y muy chulos,Se ven de calidad,es,apparel
25635,es_0184608,product_es_0661781,reviewer_es_0376145,1,"Esta muy mal hecho.no tiene nada que ver con la foto.de muy mala calidad.el relleno es horrible,mal cosido no encaja.muy feo.",M,es,apparel
98518,es_0411184,product_es_0052009,reviewer_es_0945154,3,Son muy grandes y con una estructura que parece muy endeble. Lo positivo su precio,Regular,es,apparel
85451,es_0615940,product_es_0479480,reviewer_es_0078110,3,"No es tan negro como en la foto, pero por el previo no est치 mal",Cumple,es,apparel
127581,es_0437504,product_es_0875570,reviewer_es_0880130,4,"Tienen buen tacto y un aspecto muy s칩lido y resistente, buenas protecciones para dedos y nudillos, y para el fr칤o se los v칟 c치lidos",Javier,es,apparel
131525,es_0962344,product_es_0755600,reviewer_es_0659544,4,Buen precio y queda muy bien,Buena compra.,es,apparel
30396,es_0106739,product_es_0722402,reviewer_es_0760356,1,"Es completamente inutil, no puedes manejar la pantalla ni la ruedecita. Dinero mal gastado. ADVERTENCIA!! ES UNA MERA CARCASA QUE NO PERMITE USAR EL RELOJ.",Dinero tirado a la basura. Una pena.,es,apparel
184457,es_0809281,product_es_0261695,reviewer_es_0327532,5,"muy buena calidad a un precio mas que asequible. talla un poco mas peque침a que lo habitual, pero ya estaba avisado asi que elegi la apropiada",gran compra,es,apparel
22255,es_0632452,product_es_0511753,reviewer_es_0223561,1,"Dan poca talla, no sirven para usar con el m칩vil",No sirven para usar el m칩vil,es,apparel
185322,es_0033978,product_es_0795895,reviewer_es_0263645,5,"Muy bien el servicio de Amazon y el producto, lo que esperaba. Lo que s칤 deja bastante de desear el servicio de transporte, en este caso seur. Llego tarde y no aviso de la llegada del paquete...",Laura,es,apparel
156739,es_0733085,product_es_0399960,reviewer_es_0599451,4,"Buenos calcetines de uso diario a un precio moderado, ademas, al contrario de lo que pueda parecer en la foto, las parejas vienen emparejadas del mismo color para los dos pies y no tienes que ir como un tonto de baba por la calle","No te fies de la foto,vienen bien emparejados",es,apparel
145208,es_0305598,product_es_0889479,reviewer_es_0094891,4,Est치n bien las gafas,Bueno,es,apparel
31436,es_0967463,product_es_0747152,reviewer_es_0501953,1,Pedi una devolucion y al momento ni me la gestionaron ni me hicieron el reembolso.,No solucionaron Devolucion,es,apparel
119344,es_0830628,product_es_0941693,reviewer_es_0369072,3,No avisaba que era tela de gasa. Demasiado estrecho de pecho pero bien lo dem치s. ha tardado,no es caro,es,apparel
131879,es_0976725,product_es_0522183,reviewer_es_0640051,4,"Huele un poco a cola, pero despu칠s de un lavado se va. Queda bien",Camiseta,es,apparel
118230,es_0422523,product_es_0081695,reviewer_es_0562896,3,"Suelta algo de pelusa, pero es tal y como se ve en la Foto, habr치 que ver despu칠s de lavarlo. Es bastante suave. Buena compra.",Todo correcto,es,apparel
178596,es_0045975,product_es_0933458,reviewer_es_0168112,5,Muy chulo no incluye medias,Llego s칰per tarde r치pido,es,apparel
74484,es_0502704,product_es_0807806,reviewer_es_0629851,2,"No lo he recibido aun, por un problema con el locker, a pesar de que ya me lo han cobrado",F. Javier Fernandez,es,apparel
129929,es_0885765,product_es_0356512,reviewer_es_0058254,4,"Cumplen con su funci칩n.Precio acorde a su calidad. Quiza el precio me parece un poco excesivo, pero dentro del mercado fueron las que mejor me parecieron.",Unas buenas gafas.,es,apparel
68440,es_0633483,product_es_0555283,reviewer_es_0471348,2,"Es muy barato, quiz치 no se pueda pedir m치s por ese precio, pero tengo otros polos de la misma marca con mayor calidad. Este es demasiado cutre, dir칤a yo, adem치s el algod칩n no es suave",Baja calidad,es,apparel
135418,es_0705458,product_es_0899611,reviewer_es_0891143,4,ha mi me queda muy bien,chula,es,apparel
89907,es_0408987,product_es_0727329,reviewer_es_0231926,3,La carcasa se raya f치cilmente pero protege bien el movil,Carcasa no muy bonita,es,apparel
167844,es_0855169,product_es_0366814,reviewer_es_0913937,5,"No pesan nada, se ajustan bien aunque te muevas fuerte se quedan en su sitio y buena polarizacion, por ese precio buena compra.",Buena polarizacion,es,apparel
57058,es_0516712,product_es_0283483,reviewer_es_0218655,2,"No es lo que me esperaba, no es un producto de calidad y no parece que vaya a durar mucho, el sistema que tiene para estrechar la longitud no va bien.",Mala calidad,es,apparel
90893,es_0821951,product_es_0798498,reviewer_es_0433686,3,Demasiado fr칤o para mi ojete.,M치s grande de lo que me esperaba.,es,apparel
153327,es_0661793,product_es_0855376,reviewer_es_0338399,4,Est치n bien el 치rbol es muy bonito y kedan muy bien pero un poco peque침os,Muy chulos,es,apparel
118570,es_0110316,product_es_0741991,reviewer_es_0208946,3,"C칩modos y calientes pero se me caen todo el rato,un poco rollo,el el치stico no aprieta casi nada y se bajan constantemente",Iris,es,apparel
10948,es_0713536,product_es_0398654,reviewer_es_0496209,1,No me ha gustado por q no me ha llegado el art칤culo lleva 3 semanas de retraso no se cu치nto va a tardar mas y tampoco me devuelven el dinero,Mal servicio de envio,es,apparel
116266,es_0874592,product_es_0684791,reviewer_es_0668736,3,"Muy grande , y tela bastante mala calidad pero dado el precio .. seria aceptable, llego antes de los esperado",Calidad precio ok,es,apparel
188001,es_0944415,product_es_0737140,reviewer_es_0824363,5,"Son precious... Me encantan, muy sexys y me quedan fenomenal. No valen para chicas muy altas, yo mido 1,65 peso 55 kg. Quiero decir que de ancho podr칤a valer para alguien de m치s peso quiz치s pero de altura tienes que tener cuidado por que a mi me quedan bien pero justas de altura, dir칤a yo que muy muy justas. Conclusi칩n:. Solo para personas delgadas y de poca estatura 1,60cm m치ximo.",Cliente Amazon,es,apparel
15960,es_0284582,product_es_0436927,reviewer_es_0705330,1,"Tejido transparente el치stico de la cintura mal칤simo se baja no queda bien! Tardo en llegar un mont칩n, eso s칤 muy barata.",Mala,es,apparel
121416,es_0340886,product_es_0189650,reviewer_es_0582838,4,Queda perfectamente adaptada. Muy bien asustada. Tiene una pega y es que no se conecta el Jack de los auriculares. Lo he tenido que recortar. A parte de eso muy bien.,Ajusta perfecto. Tacto agradable. Buen aspecto,es,apparel
78318,es_0840491,product_es_0309939,reviewer_es_0874193,2,"칄ste producto no cumpli칩 con mis expectativas, primero me lleg칩 casi dos meses tarde, despu칠s me enviaban emails que el producto se hab칤a perdido, cuando me lleg칩 y la abr칤 no era exactamente lo que hab칤a pedido, ped칤 la carcasa con el cristal, y s칩lo me vino la carcasa. Anteriormente he realizado varios pedidos y sin problema alguno, 칠ste ha sido con el peor que me ha ido.",No satisfecha del todo,es,apparel
72694,es_0867504,product_es_0670686,reviewer_es_0932797,2,"Son pantalones bastante grandes. Yo uso una talla 36 y me quedan muy grandes de culo, los devolver칠. La tela del ch치ndal est치 bastante bien.",Grandes,es,apparel
98398,es_0953019,product_es_0933642,reviewer_es_0110652,3,Un poco amplios y se caen pero el hilo es bueno,suaves,es,apparel
40391,es_0186862,product_es_0495683,reviewer_es_0772628,2,Muy peque침a para su talla,Regular,es,apparel
102083,es_0101754,product_es_0931764,reviewer_es_0351506,3,"El tejido es c칩modo, fino como lo esperaba, pero despu칠s de un d칤a puestos termin칠 con el cl치sico tomate, roto en la punta. De los 6 pares ya le ha pasado a dos de ellos.",Rotos en la primera puesta.,es,apparel
133546,es_0951510,product_es_0986921,reviewer_es_0071604,4,El tallaje es peque침o,Buena Relaci칩n calidad precio,es,apparel
192644,es_0788297,product_es_0818778,reviewer_es_0945871,5,Todo genial y la talla perfecta . Todo est치 seg칰n la descripci칩n . Estoy encantada .Volver칠 a repetir la compra,Perfecto,es,apparel
117504,es_0531655,product_es_0438428,reviewer_es_0016396,3,"Hay que poner sujetador, aplasta el pecho.",Para una emergencia puede ser 칰til,es,apparel
46049,es_0879582,product_es_0056039,reviewer_es_0933440,2,"El lazo d la cabeza, deber칤a estar ya hecho y con una goma. As칤, es imposible pon칠rselo a un beb칠. El jersey, es inc칩modo para un beb칠. Teniendo en cuenta q los beb칠s pasan gran parte del d칤a tumbados, ya q tienes q hacerle el nudo en la espalda, y Le hace da침o.",Inc칩modo para el beb칠,es,apparel
75749,es_0693807,product_es_0290055,reviewer_es_0254867,2,"La cazadora no lleva protecciones ni se le pueden poner, como el resto de cazadoras para motoristas. Es una cazadora normal y corriente.",No es una cazadora de motorista,es,apparel
38578,es_0190218,product_es_0443630,reviewer_es_0818816,1,"Tela muy endeble, no lo recomiendo","Tela muy endeble, no lo recomiendo",es,apparel
199997,es_0484496,product_es_0358101,reviewer_es_0330744,5,Buena calidad. Satisfecha con la compra.,Buena calidad.,es,apparel
26170,es_0238644,product_es_0388198,reviewer_es_0770191,1,Es peque침a y la impresi칩n del dibujo se ha marcado en otros sitios.,Sudadera Harry Potter,es,apparel
105690,es_0703455,product_es_0905843,reviewer_es_0422394,3,Se me cayo una vez o quiz치s dos y se rompi칩 en la punta,.,es,apparel
116370,es_0154214,product_es_0580200,reviewer_es_0201611,3,"Vino con un hueco en la parte baja y a pesar de que la tela es muy simple y no queda del todo bien, por el precio normal, siguen quedando bonitos pero no te fies de estirar mucho con ellos.",Mal hecha,es,apparel
198510,es_0994069,product_es_0381207,reviewer_es_0203734,5,Quiz치 las tiras un poquito m치s anchas de lo que me esperaba y largas. Pero por suerte eso tiene arreglo.,Queda bien.,es,apparel
42769,es_0988985,product_es_0370935,reviewer_es_0275647,2,"La corbata est치 bien teniendo en cuenta su precio, pero el pa침uelo sin m치s, pero el acabado de los gemelos es muy deficiente, hechos de una aleaci칩n barata y de cualquier manera. No repetir칤a con esta marca.",Justito,es,apparel
47324,es_0711182,product_es_0354417,reviewer_es_0161611,2,Lo mismo que el otro lo he pedido hace mucho tiempo y no me ha llegado,Espero llegue,es,apparel
168839,es_0956475,product_es_0174947,reviewer_es_0120827,5,"Perfecto, c칩modo justo lo que esperaba",Perfecto,es,apparel
36328,es_0050085,product_es_0327056,reviewer_es_0742345,1,"Desgraciadamente, este producto NUNCA lo recib칤. Se lo he comunicado hace unas semanas. Pero NUNCA tuve ni contestaci칩n al respecto, ni art칤culo encargado y pagado. La verdad estoy un poco defraudada.",Nunca lo recib칤,es,apparel
158486,es_0893982,product_es_0175192,reviewer_es_0191476,4,"Estoy encantado con la camiseta. La talla es una poco peque침a, pero puedo llevarla perfectamente. El dise침o y la calidad de la tela, perfectos.",Encantado con la camiseta,es,apparel
