,review_id,product_id,reviewer_id,stars,review_body,review_title,language,product_category
80321,es_0400411,product_es_0962131,reviewer_es_0932233,3,"La calidad del producto es buena, tengo una talla 58 y los ajustes quedan por la mitad, no creo que valga para una 55. Las hebillas de los laterales me quedan justo a la altura de las orejas y resultan algo inc칩modas. Respecto al color, estoy muy descontento ya que pon칤a azul oscuro y es azul marino, esto es por lo que pongo 3 estrellas y no 4.",Contento pero...,es,apparel
188010,es_0548907,product_es_0818688,reviewer_es_0401856,5,"Cumplen su funci칩n y son una moner칤a, me encantan. van en el coche, y con los deditos fuera para poder trabajar.",Mon칤simos,es,apparel
116617,es_0054869,product_es_0785549,reviewer_es_0420167,3,"Calidad parece buena.Color y brillo muy bonitos. Pero los imanes no van, lo cual le quita gran parte de la gracia.",Bonitos pero el im치n no funciona,es,apparel
164541,es_0491610,product_es_0197801,reviewer_es_0728496,5,Fu칠 para un regalo y genial. Buena calidad relaci칩n precio. Los pap치s quedaron encantados con este kit completo. Acierto seguro.,Pijama azul real MADRID,es,apparel
78346,es_0761961,product_es_0819148,reviewer_es_0829754,2,"Pues eso, despues de 2 meses de uso, no muy excesivo al final se me termina partiendo por el puente, y no hice fuerza, aparte el material no es de cristal, es un pl치stico especial, creo que deberian reforzar el puente o usar alg칰n tipo de material m치s resistente y el치stico",Se rompe el puente f치cilmente,es,apparel
96310,es_0458632,product_es_0143717,reviewer_es_0906657,3,Las gomas de silicona no sujetan bien...son algo peque침as...pero por el precio no est치n mal en general...recomendable pero no demasiado,Carol,es,apparel
20706,es_0567307,product_es_0888991,reviewer_es_0885514,1,Le queda peque침a la parte de arriba y grande la parte de abajo. fatal. Muy mal,El tallaje desastroso,es,apparel
59295,es_0132910,product_es_0500833,reviewer_es_0605078,2,No se puede pedir mas por ese precio.,Aceptable,es,apparel
49893,es_0155627,product_es_0387969,reviewer_es_0503227,2,El producto es demasiado grande y de tejido grueso nada transpirable,No es lo que esperaba,es,apparel
178897,es_0120597,product_es_0127172,reviewer_es_0729331,5,Buena calidad y comodisimos,Mi esposo encantado,es,apparel
117546,es_0447144,product_es_0460684,reviewer_es_0947367,3,"Estan bien y ,,,es barato",Oscuros los cristales,es,apparel
9557,es_0740452,product_es_0760512,reviewer_es_0736494,1,"Ped칤 una XL que es la talla que mi marido tiene en Espa침a. Cuando lleg칩 se lo prob칩 y le quedaba como una M. Al descambiarlo, el vendedor me dijo que no se lo devolviera porque esta a en China, que me lo quedara y me reembolsaba el 60% y as칤 fue. Como me gustaba, ped칤 la XXL (2 tallas de por medio) y hoy me ha llegado. Para mi sorpresa: 춰son ambos chalecos exactamente iguales! Le sigue quedando igual de peque침o. Es decir, otro timo. Por lo que, si buscas tallas grandes, no lo aconsejo.",Un timo,es,apparel
77964,es_0341513,product_es_0806358,reviewer_es_0116433,2,Un poco justos de tama침o y el material es de menos calidad ad de la esperada. Es mejor gastar un poco mas en otro producto mejor.,PSE,es,apparel
26630,es_0636410,product_es_0730764,reviewer_es_0342711,1,"No se corresponde nada con la Foto, el tejido mal칤simo",Disfraz,es,apparel
99393,es_0853957,product_es_0940303,reviewer_es_0189170,3,Al tener las patillas de madera no es posible ajustarlas debidamente. La unidad que me lleg칩 ten칤a una patilla m치s alta que otra y no se pudo arreglar,Preciosas gafas de sol,es,apparel
140030,es_0393972,product_es_0799260,reviewer_es_0798053,4,He pedido una 2XL y corresponde a una XL un pel칤n justa. Este tipo de chalecos son ajustados al cuerpo. La verdad es que me ha sorprendido positivamente la calidad de confecci칩n. Ya veremos con uso m치s intenso,Buena relaci칩n calidad-precio,es,apparel
138180,es_0949232,product_es_0434629,reviewer_es_0270133,4,"Para mi gusto demasiado ajustados y gruesos, para deportes ligeros quiz치s pero para carreras, da sensaci칩n de comprimir las u침as, quiz치s las tallas no est치n bien calculadas, yo ped칤 para 40, quiz치s deb칤 coger un n칰mero mas",Gruesos para correr,es,apparel
110036,es_0641411,product_es_0109628,reviewer_es_0709057,3,"No me acaba de convencer. El adorno del fondo baila un poco. No asienta, es decir, no queda bien cerrada alrededor del tel칠fono y creo que meter치 suciedad muy r치pido. En los botones no acaba de asentar bien. Por el precio, no se puede pedir mucho.","Correcta, adecuada al precio.",es,apparel
141419,es_0873917,product_es_0035830,reviewer_es_0410785,4,"No pens칠 fuera tan transparente . Y buen escote , menos mal tengo bastante pecho . El pedido lleg칩 r치pido antes de la fecha .",Ped칤 una talla m치s y perfecto .,es,apparel
56426,es_0007713,product_es_0463787,reviewer_es_0508450,2,"Mido 1,83 y compr칠 el modelo XL, que en teor칤a deber칤a abarcar hasta justo mi estatura. Pues de ancho bien, pero de alto se me queda muy corto el pantal칩n, falta como medio palmo para que llegue hasta el tobillo y la sensaci칩n es muy rara.",Peque침o,es,apparel
55930,es_0144581,product_es_0565938,reviewer_es_0229547,2,"Ojo con la talla, que son muy peque침as",original pero peque침o,es,apparel
157136,es_0476571,product_es_0291964,reviewer_es_0942580,4,No ha tardado demasiado en llegar.Aunque es fino pero resulta calentito.Esta bien cumple su cometido.Se puede comprar sin ninguna duda,muy bien,es,apparel
26434,es_0979515,product_es_0976166,reviewer_es_0887368,1,No vale la pena gastar ese dinero en estos pantalones ... mala calidad. 2 veces puestos y ya hace pelotilla y se siente muy d칠bil la tela,Mala calidad,es,apparel
132438,es_0778814,product_es_0969081,reviewer_es_0874861,4,Buena relaci칩n calidad-precio,Cumple espectativas,es,apparel
180965,es_0891405,product_es_0351107,reviewer_es_0015217,5,"Es chulo, ped칤 la talla M y me va perfectamente, lleg칩 antes de la fecha, la textura muy agradable, sin duda pedir칠 en m치s colores",Satisfecha,es,apparel
44896,es_0744001,product_es_0481703,reviewer_es_0678329,2,"Ha tardado dos meses en venir y no tiene nada que ver con la foto, la calidad es muy mala.",Alicia,es,apparel
186571,es_0136379,product_es_0178299,reviewer_es_0250842,5,Me encant칩. El vestido perfecto. Me quedaba como un guante. Le gust칩 a todos. En la boda fu칠 super original!!!,El mejor vestido para una boda,es,apparel
84243,es_0047831,product_es_0136255,reviewer_es_0715020,3,"El producto en s칤 est치 muy bi칠n, aplana muy bi칠n la barriga, estando c칩moda pq no se claba nada, ni aprieta m치s q lo necesario por la parte de la barriga hasta por debajo de los pechos. La pata a modo culote largo la hace m치s bonita y util, tanto si se te juntan los muslos y por el roce molesta, como si no sucede esto. Puesta queda muy bi칠n, no se ve como faja de vieja, se ve una prenda bonita qu칠 estiliza mucho. Lo malo es q la parte de la faja q va desde la cintura hasta debajo del pecho, es doble tela y para verano te asas de calor, pero la parte de las patas, es tela m치s ligera. Hay q comprarse una o dos tallas m치s grande de la que use cada uno en Espa침a, porque si compras tu talla exacta queda muy estrecha, la parte de las patas corta y est치s incomoda.",Prenda que estiliza mucho y queda muy bi칠n,es,apparel
8410,es_0146733,product_es_0986863,reviewer_es_0286278,1,A pesar de la claridad en la talla pedida me envian otra mas grande y me toca hacer todos los tramites de la devoluci칩n,Pido una talla y me env칤an otra diferente,es,apparel
150654,es_0108900,product_es_0084468,reviewer_es_0433757,4,"Protege bien el m칩vil. Los dibujos son bonitos, pero el dibujo de los anillos no encaja con el logo, por lo que pierde gracia.",Anillos,es,apparel
53546,es_0439381,product_es_0444970,reviewer_es_0575020,2,"No era como yo esperaba, da muchisima talla de mas, y no se moldea al cuerpo queda suelto por todos los lados, asique es una pena de gasto de dinero para que os hagais una idea una L/ es en realidad una XXL. gracias",Sara,es,apparel
101603,es_0862900,product_es_0928917,reviewer_es_0498914,3,"No son muy antideslizantes, son comodos, calidos y comodos",Calcetines antideslizantes,es,apparel
99271,es_0430504,product_es_0798179,reviewer_es_0895311,3,"Las compr칠 para un ni침o de 12 a침os, y les da ca침a, corriendo, jugando y tal ,son fuertes y se parecen a la marca Adidas, que tiene 3 rayas 칟sta tiene 4 ,las recomiendo",Parecidas a Adidas,es,apparel
1443,es_0132405,product_es_0485864,reviewer_es_0879826,1,"Un poco cutre la verdad. Pero claro, para lo que vale que quieres.... Demasiado peque침o para ser una L. Pedir una talla mas. Por lo dem치s bien",Regular,es,apparel
126617,es_0607931,product_es_0216405,reviewer_es_0198195,4,"Algo m치s peque침os de lo q esperaba, pero por lo dem치s genial, se corresponden con la descripci칩n. Llegaron antes de fecha estimada.",Muy bien,es,apparel
15836,es_0469181,product_es_0322747,reviewer_es_0956703,1,"Pelandose despu칠s de poner solo una semana ,malo, a simple vista se ve bien pero no",Malo,es,apparel
49402,es_0103159,product_es_0283483,reviewer_es_0542707,2,"Calidad muy mediocre, se nota que es sint칠tico y del malo",mediocre,es,apparel
77022,es_0972198,product_es_0095133,reviewer_es_0664976,2,Muy barato pero muy malo.,De juguete,es,apparel
46317,es_0537786,product_es_0215142,reviewer_es_0603066,2,"No es de verano. No transpira apenas y se llena de sudor. Si no la pusieran como gorra de verano, le dar칤a seguramente 4 o 5 estrellas, porque los materiales no son malos y la gorra en s칤 est치 bien, pero como gorra transpirable y para llevar con el sol del verano, vale muy poco...",Muy bien si fuera para invierno,es,apparel
196683,es_0131917,product_es_0793757,reviewer_es_0406486,5,Es igual a la foto. Queda genial,"Calidad, precio y novedad",es,apparel
173281,es_0842375,product_es_0072218,reviewer_es_0910462,5,Me encanta la calidad y resistente,Muy buena,es,apparel
197523,es_0458106,product_es_0751097,reviewer_es_0412728,5,Bonito disfraz y con buen acabado,Buena compra,es,apparel
89957,es_0338059,product_es_0966847,reviewer_es_0650780,3,Tanto el gorro como los guantes me iban justos y no soy muy grande. Los he devuelto,Para adulto es un tama침o justo,es,apparel
184927,es_0619053,product_es_0628558,reviewer_es_0227116,5,Muy suaves y comodos,Buen conjunto,es,apparel
16104,es_0259803,product_es_0305271,reviewer_es_0236974,1,He pedido este producto hace m치s de 3 meses. Nunca me lleg칩 pero me lo cobraron. Lo reclame pero nada.,No me han enviado el producto,es,apparel
149105,es_0772456,product_es_0818529,reviewer_es_0623444,4,Calidad previo. Buen tejido y acabado,Bonita,es,apparel
149387,es_0659258,product_es_0925393,reviewer_es_0469483,4,"Muy recomendable, dise침o muy original. Tal como se describe. Compr칠 la talla 18 meses para un ni침o de 12 meses y le esta bien.Buena relaci칩n calidad precio.",Buena relaci칩n calidad precio,es,apparel
171123,es_0296271,product_es_0758200,reviewer_es_0670499,5,"Tenia ganas de una gorra con este formato y esta ha resultado ser un acierto. Buena confecci칩n, con ajuste de contorno, tejido ligero y transpirable, lo que la hace ideal para el verano. Buena relaci칩n calidad/precio. Respecto de la entrega, perfecto en tiempo y forma. Recomendable.","C칩moda, ligera y fresca, un todo en uno",es,apparel
141170,es_0392011,product_es_0542177,reviewer_es_0981256,4,"A mi beb칠 de 4 meses Le encanta. No lo pondr칤a solo de calcetin ya que son muy anchos y van grandes, los pongo encima del calcet칤n, como zapatito",Muy graciosos. Bastante anchos.,es,apparel
99458,es_0493780,product_es_0227793,reviewer_es_0323519,3,"Reducir, reduce poco. Para mi es un panty normal.",Panty normal,es,apparel
33510,es_0663712,product_es_0203302,reviewer_es_0430164,1,No se parece en nada a la foto,Su pudiera lo devolver칤a,es,apparel
97279,es_0436625,product_es_0757609,reviewer_es_0235034,3,"Comodidad en su colocaci칩n y realizan bien su funci칩n, pero parecen algo endebles.",Apropiadas,es,apparel
171325,es_0464750,product_es_0095004,reviewer_es_0994823,5,Muy contenta con el producto lo compr칠 para mi hijo es de buena calidad y la talla va bien,Bueno bonito barato,es,apparel
108465,es_0004739,product_es_0760035,reviewer_es_0150351,3,Te digo todo lo que necesito decirte en el asunto. Ahora vuelvo a escribir para cumplir con el recuento de palabras m칤nimo para dejar mi opini칩n. 쮺u치nto puedes decir?,"No espere Dior a este precio, pero es lo suficientemente agradable",es,apparel
42549,es_0577209,product_es_0490984,reviewer_es_0775976,2,"Los compr칠 hace dos meses y, si bien quedan bien, la calidad deja much칤simo que desear. No dejaron de soltar bolas ni un s칩lo d칤a. Apenas dos meses y ya se est치n rajando por la entrepierna, los he tirado a la basura. Por el precio m치s vale comprarse dos en el Primark o un sitio del estilo, verdaderamente decepcionado con este producto.",Decepcionado con su p칠sima calidad.,es,apparel
162171,es_0566378,product_es_0291720,reviewer_es_0114939,5,Muy buen tejido y con buena lavada.,Genial,es,apparel
3809,es_0172217,product_es_0588214,reviewer_es_0151607,1,Mala calidad y el tama침o es totalmente desproporcionado a la talla que he pedido!!!!! Es tres veces superior !!! No me ha gustado nada,Camiseta de mala calidad,es,apparel
187379,es_0982231,product_es_0953811,reviewer_es_0231146,5,"Muy buenos para los peques, las correas se ajustan y se fijan bien, mucho mejor de lo que compr칠 (por un precio exorbitante comparado con estas) en el centro optico, y parecen ser de mejor calidad tambien.",Estupendos!,es,apparel
176989,es_0193042,product_es_0336611,reviewer_es_0355495,5,"El tejido y su adaptaci칩n son inmejorables, cumplen muy bien su objetivo, para estar en pie toda la jornada laboral.","Sin duda, volver칟 a comprarlos.",es,apparel
141118,es_0016483,product_es_0355083,reviewer_es_0422787,4,Ellas siempre disfrutaran,Para ni침os,es,apparel
51224,es_0728349,product_es_0088767,reviewer_es_0104699,2,"Calentitos , pero las costuras del trasero son horribles",Calentitos,es,apparel
34513,es_0065280,product_es_0610900,reviewer_es_0409376,1,Lamentable aun no he recibido el pedido...llevo esperandolo desde la fecha de entrega mas de 15 dias y nada de nada no lo recomiendo a nadie esto es un timo..,Fatal,es,apparel
94117,es_0563148,product_es_0457963,reviewer_es_0543798,3,Es muy grande y ped칤 una talla menos,Pedir una talla menos,es,apparel
196199,es_0894672,product_es_0034758,reviewer_es_0295227,5,Dise침o muy original y divertido que hab칤a visto en la serie. La camiseta es de muy buena calidad y su tama침o se ajusta perfectamente al est치ndar,Oscar,es,apparel
43688,es_0327465,product_es_0916574,reviewer_es_0502398,2,"Son de licra, muy inc칩modos en verano",No gustan,es,apparel
181240,es_0436749,product_es_0271388,reviewer_es_0517713,5,"Dos cinturones que cubren sobradamente mis expectativas. Fuertes y resistentes, muy pr치cticos. Una elecci칩n muy acertada",Muy buenos,es,apparel
70395,es_0941663,product_es_0057917,reviewer_es_0698926,2,"Se decolora con mucha facilidad. Por eso le doy dos estrellas. Un solo verano y ya no est치 muy presentable. Es c칩moda y su dise침o muy agradable. Por el precio, no puede pedirse m치s.",Se decolora con facilidad,es,apparel
158767,es_0607721,product_es_0596201,reviewer_es_0743028,4,"Se nota que su calidad no es muy buena y te clavas un poco el trozo de metal en la barriga, pero por lo menos era barato.",Buen precio,es,apparel
2937,es_0837945,product_es_0979722,reviewer_es_0942299,1,"He recibido una diadema en vez del jersey, como todos, creo. Yo he solicitado el reembolso al vendedor, y si no lo atienden, lo solicitar칠 a Amazon, as칤 deber칤amos hacer todos, aunque sea poco dinero, para que tengan un poco de control con los vendedores asi치ticos",Llega una diadema infantil,es,apparel
74440,es_0463959,product_es_0087980,reviewer_es_0245524,2,La talla era peque침a,Devuelto,es,apparel
129278,es_0570416,product_es_0967889,reviewer_es_0388959,4,"Los pa침uelos en si son buenos pero peque침os, agradable al tacto, buen genero en lo concerniente el producto, pero reducidos para el uso diario.",La calidad del producto.,es,apparel
52232,es_0518846,product_es_0314678,reviewer_es_0290395,2,No gust. X q es muy delgada la tele.,Pantalon camuflaje,es,apparel
69437,es_0038293,product_es_0596201,reviewer_es_0100924,2,"Le pongo dos estrellas y no una porque en realidad no me han timado en nada, es exactamente lo que se anuncia, como en la descripci칩n y en las fotos. Pero al usarlo me he dado cuenta de que la hebilla es demasiado grande, ancha y gruesa, y al menos en mi caso bastante inc칩moda, me hace da침o y al ser de chapa met치lica relativamente fina y basta creo podr칤a llegar incluso a cortar la piel. No lo devuelvo porque considero que ha sido error mio comprarlo, pero no lo uso y acabar칠 tir치ndolo o regal치ndolo. Desde luego no lo recomiendo.","Inc칩modo, no lo recomiendo",es,apparel
107846,es_0268515,product_es_0603067,reviewer_es_0372952,3,"La est칠tica est치 muy poco conseguida, solo los uso para botines y botas",Baratos pero feos,es,apparel
26148,es_0164926,product_es_0136421,reviewer_es_0632956,1,Mala calidad y n sujeta,No es lo esperado,es,apparel
156130,es_0811205,product_es_0515197,reviewer_es_0151125,4,"me gustan bastante y se vee bien los materiales parecen ser buenos asi como las lentes, la estoy usando mas de que mi otras gafas de sol rayban",a mi me caen muy bien,es,apparel
88256,es_0451794,product_es_0451398,reviewer_es_0804237,3,"Es de buena calidad, pero en mi caso ped칤 la color lavado negro y es negra negra",Buena calidad,es,apparel
148061,es_0921956,product_es_0823160,reviewer_es_0204452,4,"C칩modos y agradables, lo justo para el tema",El dise침o,es,apparel
125798,es_0492204,product_es_0670577,reviewer_es_0953322,4,Precio calidad muy aceptable,Aceptable,es,apparel
39927,es_0010119,product_es_0044157,reviewer_es_0322635,1,"Estoy muy disgustada porque el producto es peque침o lo he dicho varias veces y nada de nada, as칤 que no puedo aprovechar la compra y encima no me la cambian por otra mas grande.",Camiseta,es,apparel
142038,es_0807334,product_es_0277385,reviewer_es_0935599,4,"No es doble, 칰nicamente es el tri치ngulo que se ve, pero los bordados son bonitos y bien hechos y queda muy bonito. Por el precio que tiene esta bastante bien.",Mar칤a,es,apparel
74366,es_0466411,product_es_0972818,reviewer_es_0612808,2,"si tienes mucho pecho, se te despegan.",se despegan,es,apparel
138210,es_0407694,product_es_0841107,reviewer_es_0028882,4,"Hacen sudar un poco, no por lo calientes sino por el material que no traspira o absorbe cm el algod칩n",Buena relaci칩n calidad/precio,es,apparel
125466,es_0391711,product_es_0226387,reviewer_es_0552703,4,"Hola, Est치n bien pero el pack son 2 pares negros, 2 pares blancos y 1 par verdes. No hay naranjas.",Estan bien,es,apparel
188789,es_0324580,product_es_0031289,reviewer_es_0298763,5,"Son de color rojo muy intenso y bonito, llego s칰per r치pido.",Bonitos,es,apparel
119450,es_0082370,product_es_0812803,reviewer_es_0252659,3,"Son c칩modos al no tener costuras ni corchetes pero son algo flojos, con el uso no creo que tarden en darse de s칤. Para un busto medianamente grande no lo recomendar칤a como sujetador de uso diario y en absoluto para deportes que impliquen correr o saltar (para yoga o pilates bien). En mi caso lo quer칤a para casa y dormir, as칤 que me pueden valer.",C칩modos pero poca sujeci칩n,es,apparel
118602,es_0811843,product_es_0736844,reviewer_es_0358395,3,"ERA PARA MI HIJO , LE HA GUSTADO CUMPLE CON SU FUNCION, EL COLOR NO ES COMO EL DE LA FOTO PERO BUENO A EL LE GUSTA , Y LE QUEDA BIEN , ES COMODO Y ABRIGA",GORRO FORRADO,es,apparel
80624,es_0984518,product_es_0263268,reviewer_es_0495803,3,Bien si no tienes prisa en la entrega.,Aceptable,es,apparel
24066,es_0297451,product_es_0043941,reviewer_es_0710283,1,Las diademas no llevan ning칰n tipo de relieve por dentro y se escurren en el pelo de las ni침as. Tanto la de 3 a침os como la de 5,Encarna,es,apparel
87531,es_0705886,product_es_0081554,reviewer_es_0901697,3,"Son muy graciosos, me encantan!! No le pongo m치s puntuaci칩n porque son un poco finos.","Son muy graciosos, me encantan",es,apparel
20649,es_0308231,product_es_0670546,reviewer_es_0303337,1,Lo primero q no tiene nada q ver los de la foto con los q me han mandado y segundo q vienen distintas tallas... No me ha gustado nada. Gracias,Pedido nefasto,es,apparel
21132,es_0489405,product_es_0810245,reviewer_es_0468078,1,Es muy fino parece una camiseta,Demasiado fino,es,apparel
134997,es_0192278,product_es_0920118,reviewer_es_0860643,4,"Desde luego la talla se queda peque침a. Este lo compre de regalo para una ni침a de 6 a침os (se supone que es la talla) y al final se lo ha quedado mi hija de 4 y le queda perfecto, dudo que llegue al a침o que viene.. As칤 que si lo compras, pide una talla por encima sin ning칰n miedo. El pijama al desempaquetarlo huele un pelin mal, a almac칠n, pero no excesivamente, con un lavado listos. Bastante fino, para mi hija calurosa que se destapa pues bien, pq as칤 no se destapa, para normalmente seria para primavera. Por supuesto la ni침a encantada con su pijama de lady bug",Pijama de entretiempo,es,apparel
52027,es_0921527,product_es_0133856,reviewer_es_0529769,2,"El dise침o es tal cual se ve en la foto, pero para mi gusto la piel es de muy baja calidad",Piel de baja calidad,es,apparel
85859,es_0977408,product_es_0928472,reviewer_es_0114902,3,"La tela parece el t칤pico tejido de un disfraz barato de carnaval y la cremallera no es demasiado buena. El color real de las flores no es tan vivo c칩mo se ve en las fotos. No obstante, da el pego y queda bien. No es para abrigarse, sino para llevar una manguita larga cuando refresca.","Se ve correcto, pero es bastante justito de calidades.",es,apparel
47800,es_0309590,product_es_0997666,reviewer_es_0188768,2,El material para su precio est치 un poco justo pero al probarmelas me quedaron muy grandes la Verdad esperaba mucho m치s por su valoraci칩n,Mas mal que bien,es,apparel
96674,es_0739013,product_es_0496044,reviewer_es_0149808,3,El precio es correcto por la calidad que tiene la camisa. El tallaje es el correcto pero deja mucho que desear la calidad del tejido. Es una camisa lowcost.,Est치 bien pero no es de muy buena calidad,es,apparel
199723,es_0878794,product_es_0302045,reviewer_es_0769992,5,"Preciosa, todo el mundo se quedo alucinado con la corbata. Tanto con el color y el estampado. Tela de gran calidad. Una compra con la que estoy satisfecho completamente.",Preciosa,es,apparel
47839,es_0155469,product_es_0101416,reviewer_es_0878329,2,"Es muy bonito,pero la parte de arriba es muy peque침a.",Peque침o.,es,apparel
138316,es_0315102,product_es_0344951,reviewer_es_0012008,4,Lleg칩 a tiempo y perfecto. Queda genial!,Regalo,es,apparel
109328,es_0550986,product_es_0984672,reviewer_es_0175585,3,"Es el producto que quer칤a, a un precio mejor que en la calle y me lo sirvieron correctamente y de forma r치pida. Es justo lo que pretend칤a.","El producto est치 bien, es lo que me esperaba",es,apparel
124820,es_0356185,product_es_0202596,reviewer_es_0504613,4,Buena relaci칩n calidad precio 游녨,buena compra,es,apparel
135995,es_0925327,product_es_0819204,reviewer_es_0953063,4,El algodon es de una calidad razonable para el precio y la imagen est치 bien.,Perfecto,es,apparel
163920,es_0917756,product_es_0977848,reviewer_es_0915321,5,Guantes c치lidos y adaptables. Muy calentitos para estos fr칤os!,Cumple su funci칩n,es,apparel
48402,es_0978464,product_es_0659589,reviewer_es_0117714,2,No hay mucho q decir de una pegatina.. Lo 칰nico q lleg칩 muy r치pido!!,Bonito!,es,apparel
145663,es_0472635,product_es_0203877,reviewer_es_0574578,4,"Simplemente me ha gustado mucho, me queda fenomenal!",Me encanta!,es,apparel
131051,es_0279965,product_es_0298883,reviewer_es_0511314,4,"la calidad/precio es buena, el patr칩n es mejorable y la imagen est치 bien impresa. Es una buena compra por el precio que Tiene",Correcto,es,apparel
46079,es_0280701,product_es_0812766,reviewer_es_0600360,2,aprieta aunque parezca mentira por abajo del pecho y yo pensaba que no.,no me queda bien,es,apparel
89272,es_0884927,product_es_0488770,reviewer_es_0402733,3,"El disfraz era adecuado y muy c칩modo. Las tallas son grandes, una amiga que eligi칩 la talla L entraba en un disfraz talla S. Las caretas estaban muy bien, si bien es cierto que 4 eran de un color m치s p치lido que el resto. Sobre el envio de los mismos fue una verg칲enza. Compr칠 14 disfraces para mi y mis amigos, pero nos los enviaron en diferentes paquetes - entiendo que hagan esto 칰ltimo pero que no los env칤en con m치rgenes de 2 semanas - por consecuencia no todos los disfraces llegaron a tiempo, y eso que solicit칠 a la empresa que se diera prisa.",Disfraces hermosos pero un modo ineficiente de enviarlos,es,apparel
32989,es_0784652,product_es_0671223,reviewer_es_0669999,1,"No recomiendo comprarla, calidad terrible y las pegatinas de los brazos despinta como si fuese tiza, por mi parte no volver칠 a comprar a esta marca",Terrible,es,apparel
28188,es_0094792,product_es_0407275,reviewer_es_0974081,1,Es orible muy mala calidad,Mala calidad,es,apparel
12385,es_0816820,product_es_0323551,reviewer_es_0865508,1,Es grande y se hace mas y m치s grande cada d칤a,Talla muy grande,es,apparel
101959,es_0204235,product_es_0432558,reviewer_es_0019138,3,Ped칤 mi talla pero me queda un poco grande. Es bastante m치s largo por detr치s. Por debajo te puedes poner la camiseta que viene u otra.,Jersey granate,es,apparel
162158,es_0951930,product_es_0366607,reviewer_es_0474932,5,"Soy 1,86 m de altura, no gordo y la talla L es perfecto.",Talla es correcta,es,apparel
